0,how have i miss that today is nation margarita day kinda doesnt go with ash wednesday
4,tonight the decid  will i be at the garden friday night for knicksheat game  here hope for a miracl
0,are you come to nz tonight or tomorrow morn waaa im so confus
4,my miami heat are go to demolish the new york knick tomorrow i am from new york but sorri knick
4,sarah g day is now on it th consecut day on the top spot
4,bless is the heart that bend it will never be broken luca scott good prebedtim oth after a busi day cant wait for tomorrow zzzz
4,freestyl wednesday  np big l jay z mo def black thought eminem yelawolf love it
4,about india auto product may end fy with  growth cmie  mumbai automobil product which took a
0,cmon leo where endymion or amsterdam i know he like amsterdam those song are shit compar to the one i put
4,rita ora on xfactor on sunday which mean shell sing shine ya light which i love which make me happi
4,just caught the last few minut of s track endymion on  great track to get readi for work with it my friday
4,richi hawtin  monday night  buffalo town ballroom  dont miss it
0,dr jan radio ue tonight with david oldfield re kevin rudd sad loss of famili cat pet deserv honour co they love uncondit
4,real test for bayern thi weekend against the in form bayer leverkusen a win at home on sunday will go a long way toward a  win streak
4,just whoop some ass in kill confirm with and  tomorrow it back to makin kat cri in gear
4,i would like to trade presid day and columbu day for the day after the super bowl and juli th pleas
4,on septemb th the finder reach italian tv with the worst titl translat ever final finder risolutor sky
4,i get to procter the psat with my homi tomorrow it onli took them three year to partner us up lol
0,i guess knicksheat is on for now pretti clear that tomorrow game wasnt go to happen
4,happi birthday to the coolest golfer in bali  may you becom cooler and cooler everyday stay humbl littl sister xx
4,ash wednesday lyric she shout to the east god u better have someth better for me caus if thi is it well i want better than thi
0,mncim the rain that stop last saturday game wast our time waits mayb ss would be play someth better tonight
0,valentin day ha been cancelledwhat whi how you may be ask but you see it simpl math
4,are you guy as readi as i am for riri th album  come on novemb  rihannanavi rihan
4,first time i ever heard ss wa in th grade and i actual love it i didnt know the song at the the time so i couldnt continu to listen
4,proud of aishwarya french honour big b mumbai nov  ian megastar amitabh bachchan say he is proud that
0,lack of commun from nycdo veri frustrat regard report time for work tomorrow thank you uft and for info
4,intermiss fc took a big step toward the titl with a hard fought  win over fellow tabl topper the real ajax on monday night
4,tomorrow is a good day to listen to lamb of god hahahaha
4,with the elect right around the corner rrfp is pleas to announc super tuesday get an addit
4,the last lectur of the day on a monday to me is like pancak day for fat kid dreami
4,have famili pictur done on saturday with my  favorit girl hannah kati  shan and my tam cant wait life cant get ani better
4,get your sweat suit it novemb and it time to lax practic tonight game at tomorrow fallbal
4,cant wait to see carri underwood on the th
4,manuel charr look confid ahead of saturday clash vs vitali klitschko charr didnt look scare as he stare
4,banana walnut pancak and a side of sausag slide up to the counter for a soda fountain sunday brunch enjoy
4,pastor winan will alway be cool wit me becaus tomorrow by the winan is one of my fav gospel song and he sent my nippi home right
4,big fan of the holiday that just involv parti st patrick th of juli halloween presid day etc
0,centr for social justic report on gang  one year after the riot â¦ d polici may have exacerb problem
4,as i sat and thought i lie total prais thank you then the winan joint
0,i havent worn makeup sinc ash wed  i dont like it anymor
4,good luck to scouser  soon to be klitschko destroy tonight in the echo against  th career ko tonight
4,the first coolamon rodeo is come up on novemb  a great day of action and a fun day for the famili
4,wow marco had no vp dure martial law but enril is the nd most power man in the philippin then
4,shaquil oneal allstar comedi jam dar constitut hall sat pm nov   washington dc look like it will be a great show
4,support were excit that stan walker  advoc are run for the kid the sunherald citysurf soon
4,think neighbor probabl dont have work tomorrow so it cool if i turn up the juda priest and just rock out all night yeah
4,go to south korea or japan for research in my th semesterwow itll be amaz faith
4,good luck to joseph calleja tonight at the brit see he appear at the royal festiv hall on friday  jan in raymond gubbay concert
0,monday morn caltrain ride from home to work is alway to short i know that i may be in the minor with that opinion fb
4,friday the main day knick vs heat
4,so here we go into the earli hour with hope some great race from san fran americascup world seri watch it fri  on ss
0,rudd rain on abbott parad kevin rudd may be tri to spoil julia gillard parti but yesterday he gatecra
4,proud of my mom for all her hard work with best busi strategi to get presid circl in sage  for the nd year in a row wooooo
4,kerri will be help out the famili in long beach tomorrow if anyon ha water cloth non perish
0,whi these mf ju blastin rella like itz the hood on saturday n shit lolz smh
4,love day in edmonton game cancel today look forward to
4,lot of fun thi weekend were at the mardi gra casino friday night from  to midnight then on sunday
4,im just look forward to the knick vers net game on thursday carmelo anthoni vers deron william my two favorit player
4,join us thi sunday on the terrac were take it deep all the way filthi rich deeafro rob maynard dj
4,iam not sure if reggi realiz thi but statist gari carter is the th greatest catcher in the  year of basebal  kid lgm
0,they stop film the butler tomorrow and i still havent found alan rickman elan he been film that movi here in la
0,just watch project x for the st time im unamaz yall hype it way past what it wa
4,talkin with proctergambl sound like it the move to makebut well see come thursday for thi career fair
0,st of all in my world there onli good n evil real ppl n fake mfsthi is whi i realli feel jlin wont make itnot durabl like yao ming
4,exhaust after a long day at wppi but readi to do it again tomorrow
0,interview at kfc tomorrow how the fuck im go to understand a singl work said idek i hardli understood the interview set up
4,just finish watch the bounti hunter gerald butler  jennif aniston check it out for the nd time around funni
4,interrest to read except if you work for rim or microsoft but it may chang soon  the mobil industri in number â¦
4,ah mayb you also prefer zulu thank no relat but where exet btw the th emerg servic is the coastguard
0,navi rabbit in for spay on tue and she just had a phantom pregnanc what time thi mean day of bunwatch and raspberri pi no citi
4,haha i hardli knew about them and one day i wa at her hous and she sat me down and made me watch the brit award with her
4,on the plu side have a gig on saturday night at the lexington  come along
4,let the good time roll tomorrow is mardi gra at st philip with the bob deang dixieland band and gumbo lunch join us at
4,cathol tomorrow is the holi day of all saint mani mani gave their live for jesu and the church all the saint defend the church
0,shit go down thi sat at neighborhood theatr dropthard
4,aki ta junior say he invit max tomorrow lol to chill in the hous
4,pancak were delici and everyth perfect now off to sleep and then tomorrow it gonna be ascot all day long
4,ty for make me a woman said at constitut hall saturday dont ever ever ever ever let someon make u feel like shit
4,find out that it nation margarita day on a thursday thi year just made have no class on friday thaaaat much better excit
4,im so happi for she is final show the world what she got blake hey monday and now just cassade pope
0,it age sinc i had kfc well apart from the mush in a bun that pass as breakfast last sunday that doesnt count though
4,effat univers win the st pg univers challeng at the procter and gambl univers competit â¦
4,dont worri edmonton tomorrow morn your main street will be clear and readi for you to drive on  i better go to bed
4,free dinner for everyon in highschool in edmonton at rahma mosqu saturday night  it go to be fun
4,get readi for the peanut butter and jam sponsor parti at santo parti hous thi saturday good look
4,come to mtsu footbal fan day tomorrow from  pm at murphi center meet the team for autograph and enjoy hotdog and drink
4,im a jr smith fan he super athlet so i kind of want him shoot with the nd unit him novak kidd cambi nd white or thoma
4,wish you were eat jacki os today come to the appalachian health summit saturday for delici jacki os lunch  health workshop
4,calgari tomorrow for the first meet of the season cant wait to get some earli race done altitud paceit
4,friday love that movi kinda awkward watch it on thursday tho
4,it friendship day come thi sunday and peopl are react like valentin day
4,with the wikileak releas yesterday it onli gonna help rd parti candid make an impact in the elect
0,anyway sorri for these random tweet about the finder unfollow for the night ill be back to normal sport stuff tomorrow
4,know the movi industri in kumasi a movi a titl ayariga for presid may not be too far away pleas dont disappoint meboffic
4,gotta hold down a dub for that flatbush zombi show on the st throw a blunt on stage or sumn
0,the big l is strictli gunplay i run thru church n pistol whip the priest everi sunday damn
0,golf capsul nick watney miss a chanc for a  on sunday in hi cimb classic victori close with a cours
4,awesom talk from awesom in the star apprentic class tonit on social media just in time for super tuesday
0,the onli thing i may truli miss about lexington is shoto
0,knick vs pacer in the nd round of associ mode upset the  bull
4,just watch act of valor for the th time  i do like that movi
4,varitek eager to learn on the job newli appoint red sox special assist jason varitek on friday reflect o
4,brook lopez the nd best offens center in the nba he not ass
4,last day of work at walgreen tomorrow cri tear of joy
4,the st thing that came to mind wa someth from flatbush zombi hahaha or omg biz marki or ol dirti bastard
4,hope youv got your ticketst for pli tomorrow night  at belo nightclub with z  san diego if
0,thi nigga just hit a full court one hand shot with brook lopezsmh st birthday shit
4,i love my girl evelyn at work she switch shift with me saturday
0,ghost rider spirit of vengeanc wa a lost caus you had nowher to go but up after the st movi and then you decid to dig a hole
0,so disappoint with the movi ghost rider spirit of vengeanc so not better than the st ghost rider movi
4,it friday befor wppi who is go thi year i am befor i leav on sunday i want to give out a fun
0,in lewi on the th theyr burn effigi of guy fawk the pope  whoever els they present dislik sussexi inde
0,final saw the galaxi foam in person on saturday let just say  smmfh ugli ass shoe
4,thursday margarita day with poker sign in befor  pm and a funtast time yeaha friday jaron bell riannon bday parti remind
4,jasmin curtissmith is nomin as best new femal tv person for nandito ako in the th pmpc star award for tv yay
0,and also havent been abl to check and cba updat sinc sunday if anyon hear ani news pleas pass it along to me thank
0,i wa definit hype for that knick and net game tonight  give brooklyn they st l fuck you hurricanesandi
4,i might act like tomorrow valentin day and pamper my gf mayb then shell feel better
4,dont miss pli at belo nightclub on saturday  with z  san diego get your ticket now
4,great tetra in india event in mumbai next event tuesday in jakarta see you there
4,a great read with your saturday morn coffe im vote for a pre work on social justic toler  equal â¦
4,oh that right duel are tomorrow ha good luck to you and will
4,jame murphi may b rightif pretenti lead to read great bookslisten to great music even just to impressy pri win in end
0,i had a nightmar last night where i miss the nd rd of my fantasybasketbal draft and they autodraft me jr smith truestori lol
4,more day to go and were off to the london confer on saturday  were excit to network with other youth council again
4,watney fire  to win cimb classic nick watney fire a under  on sunday to ralli and win the cimb classic
4,i hope miami doe thi to the knick on friday teamheat
4,watch die hard for the st time with   alan rickman make thi better than it alreadi wa
4,the winan are do the smash hit tomorrow it cool but not the same without all the brother more on the whitney memori
0,if you call me good girl one more time you may find my scold hot coffe head toward your crotchal region
4,otw back to la sall heheheh watch unoffici your for the nd time w
4,a big congrat to kevin mccarthi who wa victori on saturday in the presid day comp with a fine perform of veri steadi golf
4,hm  saturday with joey  lauren  dj  and laura sound about right happybirthdaydj
4,scoop elmbridg choir perform with brit award classic boyband blake on may th at epsom playhous yoohoo how cool is that
4,it our th birthday reggi your the best partner ever we would like to thank all of our bride who
0,khader exist isra high court will hear case of khader adnan on thursday that may well be too late where are the protest
0,not abl to watch the enril documentari but ive a sens he yet again wont like tomorrow inq editori
0,whi doe the knicksheat game have to come on tomorrow night dure biblebal oh well id rather play than watch ani day
4,tomorrow by the winan is on my heart so heavi thi morn wonder who need to hear it
4,happi th birthday rella  get drunk for me frl  enjoy your day  wish you mani more
0,you know what i dont give a shit about tomorrow yolo
4,thank for the follow brian hope you have a super tuesday
4,i gotta play that friday track by flatbush zombi to finish a great day
0,valor video shoot tomorrow night hope it stupid creativ
0,bought tix for sat net game b price jumpd and allowd seller to reneg wo proof the tix arent avail poorcustomerservic
4,thi year nba schedul got me pump for the season knick vs net in it st nba battl of new york we alreadi know it nyk town
4,thank to all who came down to mardi gra in juli at the fullerton downtown plaza last night all proce went
4,save the date   weve got some surpris come your way info on monday
0,my sister just sat up and ask where kati wa go to sleep she is a littl too old for an imaginari friend dont ya think
0,go to tri  watch act of valor for the nd time the part i seen are pretti bad ass
4,follow  find her on novemb  meet her shell be at the bell center by pm it her dream  meet u
4,the eight day of the week sarah g day where you can parti partylaughd and go crazi sarahgl on sunday guy
4,these lil girl sing birthday cake girl it wa yo th birthday the other day smh lol
0,i spoke too soon flight just cancel look like im strand in calgari ill tri again tomorrow am eek i hope i make it iycsask
0,caltrain just cant catch a break mt about  am train  struck a femal on the train track south of th street
0,nba the brooklyn net open vs the new york knick is postpon it wa origin schedul for thursday even
0,centr suffer from polici paralysi alleg jayalalithaa jayalalithaa on tuesday charg the upa governm
4,heat vs knick is gonna be the most excit st round seri
4,did you greet josh bradley last sunday hi bday i hope i love your loveteam
4,gotta love be cathol sit in a lutheran church on reform sunday i guess the cathol push it with the whole pay for sin
4,mr travi took the sat in the th grade nerd fact
0,luca scott cmon whyd you die your hair
0,machin gun kelli concert on the th me  bout  shut thi bitch down
4,load of goodi from hous of wild stylestalk stapl the label fairground and piper lane will be avail tomorrow stay tune xx
4,i admir you with all my heart lauren may the god that watch over the rest of the world bless you and keep you x
4,after that game i cant wait to see what my heat do to the knick tomorrow
4,eli young band you were great on cmaaward but you will be even better in starkvil tomorrow night bulldogbash hailstat
0,im in hawaii at the moment home next friday night dont want to come home
4,roma enjoy a run in the
0,after i tweet about gari carter photo facepalm they remov the met photo nd choic almost as bad kid hold met cap
4,im suppos to sleep now becaus of work tomorrow but sen johnni enril life is interest it keep me awak
4,won ticket on the show with to see at thi sunday tom from alsip right harvey
4,excit about for macnovemb  cant come soon enough clear for io  mac  minimalist todo list nirvana
4,it wednesday  wookie photo funni   what make you beauti  one direct cover
0,real shit ray allen meet with the knick tomorrow
0,migrain sinc saturday  a blood vessel burst yesterday in the eye where it locat ani more and ill be rock a mari colvin eyepatch
0,august th  wa the day i met mitch i regret not take a pictur with him fuck ill miss go to ss show
0,laker fan should take it as a sign that they got beat by the sacramento king twice in the preaseasonand their starter play the th
4,readi to go to lexington with and for thi game tomorrow night
4,i have a date with christian kane and the leverag team that i record tue then the finder sexi have fun night night xx
4,anyon els find it entertain that ash wednesday and nation margarita day fall on the same day
4,tennesse tech steve payn say murray state doe thing the right way  oct   pm et â¦
4,excit for the nugget game tomorrow
4,buzz that im go amsterdam on friday ajax ticket could do with turn up though fuckyouviagogo
4,a cheeki  by nick watney good enough to win cimbclass at  from   close with  to share th
4,so happi hisd ha no school tomorrow no student teach in the morn
0,ash wednesday is alway hard for me ani day focus around ash on your bodi bring back bad memori for me
4,my love for maya rudolph may be borderlin obsess i just looooov her
4,look how far theyv come sinc juli rd  they have a smash album brit award and the even beat out justin bieber for a tca
4,yeayhop runman ep  with eng sub will be out by tuesdayc wait to watch itgo go go yooruc willisyoo jae suk jjang
0,i cant forgiv farrackhan for the malcolm x thing and ninja aint done sht sinc the million ninja marchnam one thingwher the
4,sixteen tomorrow omg what an breakthrough weekend with all the fella in the build
4,as im watch candyman i realiz that it it not scari at all kinda funni or it may b the liquor either way im laffin
4,i dont see c edward do anyth but race hard on thur in duel on im sure he will be smart though
4,david hay claim a fight with vitali klitschko ha been agre accord to the sun better start protect that big toe david
4,i would still vote for enril old as he may be he make me feel that our law is sweet as it may be sour
0,i may do a mile bike ride for the giant on wed caus you know caltrain is go to suck more than the cardin
4,bel ami you are one strang movi but i like you and i must keep watchingi may have to read the book
0,if you dont know he the vocalist of the metal band lamb of god and is a sorta a rd parti candid
0,cmon dont play with the winan
4,ton of hw tomorrow lunch date with joey back to hw then magic mike with ashco befor bed
0,disappoint the knick vs net game got cancel tonight but im even more hype for knick vs heat on friday
4,right guy last competit of the night like thi statu for a chanc to win a copi of juda priest th
4,gumbi may be the answer to our forward woe the bomb squad never stop believ and we never stop believ in gumbi releasethegumbi
4,mr monday night just made my thursday night mohrstori
4,download duel for ipad now final magic on the perfect devic i may never play mtgo again dotp
4,listen in hour  for an eansiv interview with poet frank x walker who present hi work at murray state on novemb  soundsgood
4,cant wait until april  go to see riri in concert
0,they tri to pull a fast one and say today is margarita day but that is fals we may be drink margarita but it is not margarita day
4,oh an i also pick my start xi for the st bangla test on site couldnt decid between fidi an tino i like fidi tho lol
4,may  it goin down me  and throw a graduat parti at mardi gra  winchest rd suit  pm until
0,careless world tour hit up  place in cali haha the fuck yoo
4,just heard your come to calgari on the rd best news ever your go to kill it man
4,still my favorit pose of you pancak tomorrow glad your here we miss dj marcu sweet dream
4,dream high  premier on feb th with eng sub thru kb world ok note
4,the winan sing tomorrow they still got it
0,no knick tonight thi make me upset enough that i havent tweet about it you know shit gotta be real smh tomorrow night knicksheat
0,holger may have anoth select headach with carl valeri come off with a possibl injuri after  min in tonight game v cesena
4,im go to be at your santo parti hous thi saturday for the weird by weird standard parti stop by and well rage
0,miss hootersmi husbandmi lifemi photoshoot tomorrowguess im gonna drink thi bottl of wine with a xanax and pass the fuck out bye
4,robert pattinson paid tribut to hi bel ami costar uma thurman as he present her with an award at the th w
4,new haven ct come to the teen center and parti with us august st and help us end the come aliv tour with a bang
0,thi is the st halloween my kid didnt go trick or treat kinda sad they are too old for it now cuz i
4,ermahgerd whi is it onli am i want sunday to come alreadi shop spree at the florida mall ye ye ye muchneed
4,super tuesday is just a few day away can the presid make it
4,girl gone wild gon be at my school thursday shit gon be crazzzzyy make sure i be my ass on campu lol npu
4,gambl land at ludlow with our first select hold court win at  from  super duti ran well in nd and will be
4,tragickingdom is the best album of all and my favorit song off thi album is excusememr sunday morn and sixteen are close second
0,okay if you go to elon univers and do not go to the ripchord concert saturdayyour sin
0,kevin rudd talk about pm betray  updat  sunday oct   senior labor mp are again bat divid
4,love thi vid st time ive seen it jule elain it all  david archuleta sing nandito ako â¦ via
4,big day tomorrow all sandi is gonna do is give us a half as bj eastbound on stage at big fish shtick pm then zombi bar crawl
0,fyi wednesday is go to suck on caltrain if you even plan on go to work that is parad
4,morgan state  hampton univ go head to head at the nyulclass on nov  yanke stadium  wed love to see you there
4,my social media week start tomorrow kick off with socialis the internet of thing sound intrigu smwldn
0,hey mr ego octobergari carter  kirbi puckett are hofer as are youth differ isthey were class actswhich you arent
4,surprisingli i will still bob my head to anyth from mick jagger to son of sardar ye you may judg me now
4,act of valor may have just becom one of the best movi ive ever seen
0,ecuador worri about assang health  ecuador say it is concern about the health of the wikileak founder jul
4,beauti washington monument in dc as the sun set what a walk path
4,i rent sherlock  and ghost rider  thi last friday they were both good i rent journey  last night it had a realli cute guy in it
4,im so readi for to get here tomorrow anoth fun weekend in starkvil with my sweet boy
4,i just got my van for tomorrow yay and my shirt green i have a grup that go to be lile that yay photo tomorrow
4,now watch ncaa final game  in tv may the best team win
0,we alway get push out to ss with ben sheppard could be wors could be thursday night with colin murray afc
4,what a perfect day for a wed workshop the idea wa born at wppi in feband not onli is it final here it
4,so lucki that im off colleg tuesday wednesday and thursday next week when im go watch evanesc on tuesday night
0,ume follow dont forget umesvolleybal take on morgan state today at  be there or be realli bore cuz it a sunday your choic
0,bad news no gibb for saturday unless we play tv at lb we have lost befor it start santo is a liabil and will be cut to shred
4,procter isnt even here yet for my sat room and everyon els is about to starthow awesom is that
4,watch act of valor look forward to ultimatfighterfriday next friday  realli think ha the contract in the bag
4,go to make some food and watch act of valor spend my friday night relax
0,i think i may have spent too much on carmelo anthoni i onli hope that hi thickfram black glass will consol me in the postseason
4,siapin nihlik a gthat what make you beautifuljust danceboom boom pow readi for the day after tomorrow
0,doe everyon not realiz the voic is rig ie cassade pope sang in the sign band hey monday or dia wa half of meg  dia
4,right thendiet start monday probabl not the wisest choic with christma come upbut im gonna smash it
0,play jacinto on gear on guardian fer the st time nd it rain wth
4,imaaa be gone til sunday the th
4,thi is a most excel wed the  box of porto goodi that just show up at studio reenforc thi redvelvetcupcakebreakfast
4,karma vs flow join us thi sunday on the terrac were take it deep all the way filthi rich richi
4,vta score td on rd drive ledesma pass to winan ztra point good  with  min left in nd qtr
0,how can you hate on yolopleas tell me how live your nd time is
4,i have lot of spare jar marmalad is the one jam gi have not yet made so glad u found ash wed easi  uplift
4,josh bradley turn  tommorrow juli  hope all is well with you enjoy your music have some halohalo
4,friday  dracula time again at the leicest squar theatr at pm not doink anys come and join van hels ye it is i
