4,my social media week start tomorrow kick off with socialis the internet of thing sound intrigu smwldn
4,tomorrow im go to buy the ticket of the concert in mexico cityobvi in the first line
4,dont miss pli at belo nightclub on saturday  with z  san diego get your ticket now
4,watchin step up  the st one is the best with chan tatum as the main guy
4,dream high  premier on feb th with eng sub thru kb world ok note
4,i think you can get them on ticketek and they go on sale tomorrow i think
4,im excit to see the lion tomorrow
4,but a veri happi st birthday to my niec mommi jess i love you with all my heart and miss payton too who will be  in  day
4,magnific scallop monday is on now a fresh lot of whangamata scallop ha just arriv at iguana head in and
4,if you cant beat em recruit em  yhoo aol goog twx aapl inc nasdaq yhoo may have the biggest weapo
4,runner on nd no out drube be one of our best hitter should make a product out hi fault not acta
4,love the greenbrier team tip two of them and possibl harri english biggest fan may yet add him to my stake plan
4,tjo today i heard that eskom rebat is until march for the solar it nice to be connect
4,hola todo bonito dia
4,first tweet ever love san diego busi day like alway and readi for on fuel tv tomorrow
4,tell me you aint excit the twin in eurosong final they gonna win the st place â¦
4,never start work on your dream and goal tomorrowtomorrow never comesif it mean anyth to u act now getafterit
4,the record is look for creativetal ppl join profthorbjornsendrbeverli on the th from pm in rose parlor
4,fun date night with my girl home earli ice my ach bodi wish i had netflix right about now
4,im just look forward to the knick vers net game on thursday carmelo anthoni vers deron william my two favorit player
4,anyth i wonder how the aspect btwn my sunmoon fair with my rise i also have venu in sagyea lol thank u
4,sun juli   pm rock n roll the opposit  our greatest hopesa celebr
4,rememb that one time in the th grade when i love the parent trap so much that i gave it up for lent
4,just heard your come to calgari on the rd best news ever your go to kill it man
4,controversi asid the  game shown on tv for super sunday were great spectacl bestleagueintheworld
4,good morn iren  have a nice day
4,not too late to come down to our monday night open mic to sing or just have a good time iguana  w  st will be here till  pm
4,glad im go to greenvil tomorrow night tho
4,kurt convey win the boy race in  with nick diaz come in nd around  round out the top  wa kenni castro
4,happi th to hrt we love you shan  tbone
4,you know what vampir diari start in germani on monday i cant wait
4,i will be particip in a googl hangout with tomorrow im super excit check it out â¦
4,monday night footbal be the move too
4,write up my case studi so i can enjoy my weekend by go to raleigh friday  babysit my favorit twi
4,a big congrat to kevin mccarthi who wa victori on saturday in the presid day comp with a fine perform of veri steadi golf
4,congrat to lloyd robertson on the gordon sinclair award tonight at the gemini last broadcast on ctv natl news is thursday
4,ufc  thi sunday from am  anderson silva v yushin okami  dont miss it in the sport bar live
4,wow ladi gaga is actual at the britney spear femm fatal concert tonight she still listen to her music wow
4,love see you tomorrow at sm sta rosa pm ah yaaay
4,nd goal barcelona would be proud of cleverli isnt the futur he the present sneijder come soon rt pleas
4,btw come rock with us on sat in covina ill be in costum wear your as well so i dont feel like in z
4,jett loung thursday night it gonna be hot come parti with me and kenni smoov he is one of the hottest produc and mani more
4,next monday  vampir diari are back watch it veri happi now
4,good morn tomorrow my birthday ahhh im so excit  tonight will be amaz beerandtaco wattup jet
4,is that ladi in the st scene of wanderlust w jennif aniston  paul rudd the ladi from mel diner if so i am so happi to see her
4,all the best to those who are take physic tomorrow
4,good luck sylvain with your media debut today and even more luck for the season and the game against spur comeonyoublu
4,romney great line about trickl down govern wa coin by gov mitch daniel as earli as januari mitt use good sourc
4,the woman in black  the legendari ghost thriller tour to dubai and abu dhabi in novemb  decemb more
4,may the sun in hi cours visit no land more freemor happi more love than thi our own countryhappi independ day
4,first time list to red doe thi diva think she avril lavign nd  th time cantstoplisten
4,tomorrow monday and im look forward for it will be hang out with an old shatec friend of mine ying manhattan and icesk
4,enjoy a night of dexter with
4,the knick got the heat at msg tomorrow gonna be tough but we got thi knickstap gonewyork
4,text from my dad you like charl dicken  obv look at my amazon wish list too late for sunday  whi th surpris
4,novemb super tour nov  rockwel ten nov    abscbn friday market meet super tuyo and friend see you
4,day  in the big brother hous and it ingleton waterfal trail today promis some amaz sceneri
4,also back to school special celebr juic on itv tonight oushhhhh
4,on thi night of fine footi final for the nrl  afl may i take a moment to say the first round of super rugbi is onli  sleep away
4,philli girl love go to big bang kif fat tuesday etc
4,pretti good thursday night with  if onli river would stop suck so bad  qualcomm stadium
4,wit a perfectli execut crash land in the gulf of mexico today whatabadass
4,field trip to octob  breakfast at jungl islandmeet deca member from other school and find out what deca is all about
4,halloween is the third biggest parti day of the year behind new year eve and super bowl sunday
4,with the wikileak releas yesterday it onli gonna help rd parti candid make an impact in the elect
4,lol of cours my fav disney movi is the st aladdini love the nd one too
4,peter whittingham now offici overtaken the mighti roger johnson as my favorit ccfc player ever more of the same tuesday pleas
4,tomorrow our opportun to love continu the boy  girl club  jefferson meet us there at am w boot and glove if possibl
4,have famili pictur done on saturday with my  favorit girl hannah kati  shan and my tam cant wait life cant get ani better
4,isaiah prayer tonight and god thank you for all the wonder anim you made like bear lion tiger and pterodactyl love th
4,yolo ofcours but with in that life span yu may be an becom  diff ppl the life we live in aint the onli life we gone have be smart
4,see robbi kean jump off the bench claim that th goal greathattickfromrobbi
4,my sister and i are go to sm thi saturday afternoon to watch lorax i am so ask my dad for popcorn money
4,hello sweeti hope your enjoy your hol found you on here through e l jame im half way through nd bk after daysx
4,see you guy on the th of octob in bathurst along with stan walker cant wait
4,happi birthday to the one and onli josh bradley mwahahaha haaamaaaz may birthday ang charact ni david nanditoako
4,i may love asian from japan but i have a girl that im gonna marri believ it she a ghetto ass short girl that clumsi as fuck lol
4,kpop will psi be the first korean to win a grammi psi may qualifi for the upcom grammi award gangnam sti
4,realli look forward to the releas of deu ex hr on friday just annoy that north america get it tomorrow
4,spoiler alert watch the teen choic award on studio  thi sunday christina grimmi might be there have a good weekend
4,the mta will be at mondawmin metro station from pm today to celebr the baltimor grand prix well have a race car for you to see
4,tonight a show in dc tomorrow greensboro nc it been too long sinc ive perform so exit to see everyon and play the new tune
4,it still hasnt hit me yet that tomorrow is steeler  raven day
4,joseph princ fbjesu is not present to find fault with you today you may have been rais injesu is n
4,im hang out with green day tonight gonna invit the  non blond to join us after a while i love music
4,got an hour talk session with capt imran tomorrow he so smart and manag to becom a captain by the age of
4,go to finish watch the vow tomorrow  it such a cute movi c
4,caraway win by sub in the rd but i still think rhonda rousey could beat him gfyh thaoshow
4,tomorrow the jimmi donn eastbound  down preorder begin onli  preorder will be avail and it a pretti sick combo pack
4,premier leagu team of the week van persi make cut for th time thi season as szczesni evan  ashley young starhttp
4,thi friday night at the warehous dowtown shreveport  pm iren and the sleeper super water sympathi and cowboy mouth be there rt
4,one of the hottest up and come artist will be perform juli th at rex theatr in southsid pittsburgh tix onli
4,beauti washington monument in dc as the sun set what a walk path
4,went to the strawberri festiv with my babe earlier today and now be lazi mayb a dinner date tonight to top off thi perfect sunday
4,go to the georgetown game on friday imwearingblu istillloveeastview
4,sat in a boozer in bethnal green listen to the dj play  i think i like it at about bpm
4,eskom entrepreneurship educ simama ranta  provinci win school exhibit at cocacola dome    septemb see you there
4,ye im readi for hs colleg  pro bring it  make monday better we can now come home to mnf you readi for some footbal
4,brian may confirm that sacha baron cohen will play freddi mercuri in a film about the late great queen singer â¦
4,yup technolog make it feel like you are all right next door in which case come over tonight for some terra nova kain
4,dr moham morsi announc as egypt first elect presid after the gloriou th of jan revolut
4,a univers uniform in appreci militari veteran he reunit after the game saturday with capt michael p
4,love that you  keep in touch one of my favorit dwt coupl  reason i start watch in the st place
4,tomorrow is a good day to listen to lamb of god hahahaha
4,inbetween movi a week today aaaahhhh might wear my welli to the cinema caus ill be knee deep in clung
4,tomorrow is the big day discount price on botox and juvederm call and make an appoint botox juvederm madison
4,our st xi went through against liverpool th xi with a  victori aet thank to an extra time winner from man of the match
4,rungeordierun should be given a hero welcom at the arsen game on saturday
4,may just be the ultim face melt summer rock band cant wait to see them again at soundwav
4,peopl are say it one of the best show theyv ever seen brother grimm spectaculathon at east saturday at pm be there
4,emm th birthday cake with big time rush â¦ via
4,look forward to watch the mackem smash the mag roll on sunday
4,im enjoy celebr juic instead of sleep go to be fook tomorrow though
4,a win for either metronomi everyth everyth or pj harvey would be a satisfactori outcom for tonight mercuri award
4,i know im still in alabama but ill be back soon next thursday ill be featur at baker so you gotta come through
4,the bull head to cle friday night one night doesnt a season make but that wa a solid win over wsh on open night
4,good luck to girl tenni as the take on south torranc today on st round cif golion
4,let the good time roll tomorrow is mardi gra at st philip with the bob deang dixieland band and gumbo lunch join us at
4,follow  find her on novemb  meet her shell be at the bell center by pm it her dream  meet u
4,i just finish dexter season  i serious cant wait until season  on octob  check out the trailer for it here â¦
4,im excit for riri th studio album unapologet see the album
4,now that the sun is on him my iguana is more activ
4,mail in a lather over cs schedul of four lion to coincid with th anniversari of  too good a film for stunt schedul i think
4,pack brown look to rebound lorenzo brown and the wolfpack are hope today game against the d raleighnew
4,sixteen tomorrow omg what an breakthrough weekend with all the fella in the build
4,i still want that birthday cake remix that i want on saturday
4,ckt updat pakistan hope of bangladesh visit pakistan cricket board said sunday it hope to from shariq
4,happi friday everyon except you gandhi becaus your dead hahahahahahaha
4,track texa am footbal player in the  nfl draft texa am may have the biggest surpris of the  n
4,amaz that derrick on hi th birthday get call up from the d leagu to an incred franchis like the san antonio spur
4,of us watch and the girl tonight beat everton live on espn in a bar with a beer in spain coyg
4,a live in cebu at the waterfront cebu hotel and casino on novemb  â¦ cebufinest
4,so proud of for the huge upset against maryland time for us to do the same tomorrow night godeac
4,the takeaway from tonight game the colt run defens wa huge and curti painter right owe us all us especi a big finger
4,and the sox beat the yanke today so i can smile
4,would you be up for full day of movi at mine on thursday so far tarzan and the notebook is on the list
4,glad twilight night wa a success ill make it to the next one sorri to be the lameo
4,it tuesday  time for young life pm union lyceum takin it up a notch tonight come join us whywouldyounot
4,guy the marijuana law in colorado oregon and washington can pass thi tuesday highhop
4,and on top of it all my horoscop is super posit and my coffe is so delici today hey wednesday we can get along
4,anoth day of iss tomorrow it wont even that bad
4,they may not be the best look of pred but they sure are comfi and snug worth it plu swag colour
4,cant wait for you to come to dublin on monday so excit to see you
4,we love the king  year ago today elvi presley releas hi doublesid hit dont be cruelhound dog
4,if you havent seen your good give guid yet check it out onlin the challeng start nov   we appreci your support
4,happi th from the bomb squad
4,i wish i have the abil to influenc everyon to like rui en hahaa cmon she so cute
4,im a jr smith fan he super athlet so i kind of want him shoot with the nd unit him novak kidd cambi nd white or thoma
4,rememb to tune into thi week legend quest on syfi tonight the team are on the trail of merlin and king solomon  what a fine blend
4,next person to comment below win  ticket for tonight or tomorrow night colt game against the mcallen thunder
4,victor cruz is happi about hi contract negoti with the giant tuesday on hi weekl
4,alright ill go to ticketek tomorrow and su it for you
4,love take a youtub break next day hd tv will be here and saturday will be a beast vid
4,more day to go and were off to the london confer on saturday  were excit to network with other youth council again
4,ermagerd conor oberst is play the barbican centr in februari i must find a way
4,prayin for the famili that lost someon today in the plane crash pavol demitra one of my favorit player rest in peac
4,stimul  promis speech of the world bank presid jim yong kim in the annual meet held in tokyo on oct
4,man unit equalis today wa superb hope well be see mani arsen move like that with a shot at the end thi season
4,watch gandhi with gaurika today wa so nice answer her  question we should have some new age patriot movi though
4,i just realiz that tomorrow is friday which mean tomorrow is the kingsburg vs selma game excit
4,yell im so proud of my son trayvon hell be get acknowledg in tomorrow assembl he is student of the month just thank god
4,eli man best th quarter qb in the game
4,happi birthday to haryana march on the path to progress
4,karma vs flow join us thi sunday on the terrac were take it deep all the way filthi rich richi
4,a win over england on the th day of the rd test match will give us one more reason to celebr the independ day via
4,big day out on nov  galleri hoppingtalksguid tour  more my list of must see gallerieseventshttp â¦
4,anoth heat game tonight between nsc minnesota and fc tampa bay be sure to make your predict week  is alreadi up
4,french press cup of verv lo naranjo with a bit of hank william good morn
4,happi new year to those who arent into anno domini shana tovah  all that good jazz look forward to the chines new year in feb
4,yall know that one boy that make it seem like he won st place in the kentucki derbi whenev he get a good grade yeah we have that now
4,i guess im go to watch anderson silva whop a nigga ass while drink grey goos tonight
4,we nail the trifecta at belmont today for  in the th race check it out
4,congrat to trey haley shawn armstrong  and alex monsalv for be name to the afl rise star team game is sat pm
4,hello greet from mexico citi when mblaq will come to visit the a mexican fansi true that go to brazil on septemb
4,thank dave great show tonight sorri craig ive got to get to bed ill catch you tomorrow david letterman
4,next sat kid club film is the lorax with more fun n free activ befor the film from am film
4,excit to go see rise of the planet of the ape tonight
4,good morn thursday life is fragil were not guarante a tomorrow so give it everyth youv got  tim cook do it for job
4,good monday everybodi wish we could start thi morn with a littl king cake
4,random friday fun where in scotland doe legend have it that merlin the wizard die
4,tennesse tech steve payn say murray state doe thing the right way  oct   pm et â¦
4,happiest babi on the block class is be offer at nation nanni train day april thhttp
4,thank for everyon who came out for day  of world music festiv well see you tomorrow at am for a global groov danc parti
4,thi is a most excel wed the  box of porto goodi that just show up at studio reenforc thi redvelvetcupcakebreakfast
4,still on armi duti in alabama but think about how lucki i am marri me yr ago today
4,vampir diari and jersey shore tonight so first we see some hotti then we fist pump with hotti sound great
4,th album out red millionswifti  grammi award  ama  bmi award reign entertain of the year acm yearstaylorswift
4,so glad that the classic brit award are on itv  on sunday have set the record button just in case i forget to watch
4,i would like to trade presid day and columbu day for the day after the super bowl and juli th pleas
4,as we patient awaitrt  back in studio put final touch to the albumshould be out nxt week friday
4,hey daryl great connect at anti frack colorado excit to have you in next issu deadlin is nov th
4,on septemb th the finder reach italian tv with the worst titl translat ever final finder risolutor sky
4,just did spartacu  and saunaimma be sore tomorrow but so worth it
4,trill young savag finna walk around the crib nake tomorrow tho best believ
4,belladonna zylona is at aladdin tonight  come enjoy the show hold on to your hookah  here direct
4,im drive in to long beach saturday if anyon ha cloth food clean suppli linen to donat pleas let me know thank you
4,the hottest open mic is team up with the hottest organ in tallahasse you dont want to be left out join us next friday pm
4,ate danica thank you so much you make may day happi ate pwede po ba makuha number mo
4,look forward to see all our potenti  particip next saturday for our free taster at the joseph wright center
4,noel gallagh tomorrow cant wait to see the legend
4,parti in the hous tonight everybodi gonna have a good timehappi independ day jamaica
4,world bank prais electr access improv in malaysia from previou th now it is th in posit bnbagu
4,it friendship day come thi sunday and peopl are react like valentin day
4,home now and i am sack out with my puppi on my couch on the afternoon sun after a long thursday dougla adam wa a geniu hhgttg
4,good luck in the nn race tomorrow ill be cheer you on as alway
4,imagin danica and daniel meet on friday and the feel you get to say that you help out amaz jbmeetdanica
4,rum chata hot chocol thin mint and netflix thi is how you do saturday
4,big night go to watch the card thrash the pirat for a bit and then the  debut on mnf cantwait
4,wish i couldv went to see miss may i tonight at hous of blue
4,trayvon my daili tweet  in memori of trayvon martin  kill  day ago may you rest in peac we must never forget you
4,oneil barber  beauti will be open monday am and not close to the last person leav wegrind
4,just about that time nba season jump off tomorrow my preseason mvc most valuabl cat and bbn
4,saturday i buy my ticket for the tmhtour in belgium im so happi
4,go to south korea or japan for research in my th semesterwow itll be amaz faith
4,thank still have love for my galaxi i will cheer us on to victori at the stadium club tonit beat dalla
4,hope u have a great show tonight me  the chiin girl are so excit to see you in london tomorrow
4,vta score td on rd drive ledesma pass to winan ztra point good  with  min left in nd qtr
4,dude you definit need to get a part in true blood we had pole dancer again thi year at the uk convent parti tonight
4,support were excit that stan walker  advoc are run for the kid the sunherald citysurf soon
4,im so excit becaus you are come to mexico citi in octob i love you follow me pleas nsn
4,word tonight the night dexter
4,you off to cork  have lot of fun  safe trip youv done a lot sinc your st meet at eurosong haha
4,just found out that the new season for vampir diari come out sept th
4,morn tweep im go to milan today yaay
4,isat tomorrow make it or break it for north georgia get a good night sleep tonight
4,watney fire  to win cimb classic nick watney fire a under  on sunday to ralli and win the cimb classic
4,shate rt celebr juic tonight pm itv hurrraaaaah it a back to school special
4,bois state chattanooga embryriddl and virginia tech receiv their charter tonight congrat and welcom gentlemen duli
4,dt make sure you find your self at the sec thi thursday for  thursday  w colleg id  w reg id til pm iparti
4,perhap they want a rd choic hahaha like ben amo at mufc
4,page paper due tomorrow and what am i do with my time watch the anim planet weeeeeee
4,look forward to celebr juic tonight
4,so cycl fan tweepswho is go to win the men race tomorrow then i reckon phillip gilbert or tom boonen swoon
4,grassroot race at it best return to marana on saturday octob  at the gladden farm k an
4,ayyyyy babi girl fresh will be at the hous of blue in decemb make sure yall come out and support
4,look forward to inspir the makeup artist of tomorrow with my red carpet workshop at in liverpool as guest lectur
4,cannot wait for thi cowboy game tonight start it off right romo j e t s sucksucksucksuck
4,casual walk around the hous singingdanc and yell robsten is unbroken yo octob   yo i think im gonna faint yo
4,otw back to la sall heheheh watch unoffici your for the nd time w
4,twittervers blow up about shannon sharp awesom hof speech well have the video clip on nflcom a littl later tonight
4,attn hicksvil tiger schulmann final ha it power back class will resum as normal tomorrow we
4,check out the amaz world music festiv organ for the th consecut year by rialto theatr in limassol
4,gotta love be cathol sit in a lutheran church on reform sunday i guess the cathol push it with the whole pay for sin
4,is come up thi weekend were super excit play the blue stage on sat night right befor aap rocki
4,true blood tonight alway the best night of the week
4,purim dancer run in the th today the local goat must be wish her good
4,look for someth to do thi weekend in cni here are the best bet thursday rapper wiz khalifa will headl
4,luci hale is trend worldwid the girl from prettylittleliar are get some love from the fan tonight congrat
4,x factor home made goodi jacuzzi and sacha baron cohen perfect saturday even with
4,lipa  beat the bad weather join us for our taster session wed and thur at joseph wright centr
4,happi thursday jennett from detroit  radio station wrom radio have a great weekend ahead we love a follow back from you
4,black actress shine at the th annual ell magazin women in hollywood celebr octavia spencer viola davi andhttp
4,on tha real tho i dont care if you never go to your school young life you should definit go to all citi tomorrow night yl
4,sunday night loung jett loung is the destin big leo celebr everybodi free all night pool t
4,thought you might appreci thi photo taken of aj at the celebr sunday better than anyon
4,i may be a littl too optimist but i think the brown vex themselv of the baltimor curs and beat the raven mayb it just me lol
4,finish fill out the fafsa for thi scholarship applic hope it process befor novemb  caus i need it by then
4,luci hale is trend worldwid the girl from prettylittleliar are get some love from the fan tonight congrat
4,effat univers win the st pg univers challeng at the procter and gambl univers competit â¦
4,look forward to go to the colt game thi even
4,australian direction igo one direct icarli is premier on nickelodeon the th of juli at pm  how excit x
4,sunday night concert in the park eagl cover band pretti good
4,i hope notr dame win tonight and the steeler win tomorrow
4,david letterman had an interest show on monday he is locat in new york citi becaus of the hurrican he
4,holi shit wa it social justic sunday on tumblr or someth becaus wow stayingthefuckawayfromtumblrsj
4,good luck to joseph calleja tonight at the brit see he appear at the royal festiv hall on friday  jan in raymond gubbay concert
4,were excit for trunk or treat tomorrow nov  night at the boy and girl club in pottstown it will start at
4,cant wait for to hit up az on sunday let the debaucheri begin
4,foothil vs laguna hill is game of the week it air friday  pm saturday  and  pm sunday  and  pm   pm   pm
4,monday at town ballroom richi hawtin with loco dice dude is so awesom tix still avail at
4,safe and sound at flib well be all over the dock tomorrow
4,i have  say i thought the emmi were great tonight melissa mccarthi peter dinklag kyle chandler ty burrel juli bowen all amaz
4,i need to go find some sweet then im outttt anoth  hour day of march band tomorrow nevergetsold
4,awesom show today with jimmi bryson tomorrow though we have trent anderson and rhonda rousey also more reo ticket to giveaway listenup
