4,micca tomorrow my support for the march band is ridicul needstostop butilovethemsomuch itssoearli eyeswithprid maybenextyear
0,so you want peopl like chief keef  ted nugent to have gun cmon son debat
0,the school are also in the middl of istep test so they may not be abl to get back to you yet
4,excit for tomorrow photo session with indhi fashion design studio at theloniousstudio
4,bright side of the sun  recap the recap see what other said about the sun loss to warrior sun â¦
4,the march band is play the rd quarter danc song right now and i can hear it from my class i gotta do it cant stop
4,tomorrow okami will be releas on psn in hd cant wait to play it again to me it one of the greatest game ever made okami clover
4,tennesse is go to kill troy on saturday
4,im hook on hors racing been to the del mar racetrack in san diegoand now i wanna go to the kentucki derbi
4,on june  andrew breitbart offer a  reward to anyon for the full journolist archiv sourc fulli protect
4,tomorrow night it your chanc to slay a dragon in jerusalem old citi
0,that girl rhonda rousey is bad and she got  ws all by way of  st rd arm bar badass
4,premier leagu team of the week van persi make cut for th time thi season as szczesni evan  ashley young starhttp
4,first game of the season for the laker tomorrow cantwait
4,for georg strait in march at the houston rodeo look like i need to start save
4,in rugbi news are win  at cobham with the fourtri bonu point in the bag see the monday gazett for a full report
4,be sure to watch the broadcast premier of the offici  iditarod race documentari  sunday pm
4,new list come in laguna hill ca  bed plu bonu room pool  car garageto hit the market offici tomorrow
0,nd zen dixi if you dont read  share god will kill a babi kitten i will haunt you w redund  bad pun
0,ugh had iss today  gonna have it tomorrow too  gay
4,plant citi is babysit nyc palm tree for the winter crap like thi crack me up â¦
4,sunday night loung jett loung is the destin big leo celebr everybodi free all night pool t
0,simciti delay it availabilityhttp â¦
4,turn out saturday match at white hart lane wa ramir th for the club that a big mileston
4,mark martin the st to crack  mph and now lead a mwr  bowyer nd and toyota  kyle rd after  car nascar
0,correct march band is cancel tomorrow whi in the world wld we think they had common sens to cancel school so earli duh
4,babysit all day tonight blahhh but cant wait for friday club puls babi whoot whoot
4,open lobbi wa fun today hope itll be cool tomorrow too
4,happi birthday roman abramovich  octob   keep the blue flag fli high
4,so proud of the ladi from my famili group from kremlin today who place rd at the jhigh state cross countri meet so proud of ya ladi
0,if the world end in decemb imma find justin beiber and castrat him befor i die
4,jose mourinho we want to win the playoff and if we win tomorrow that best halamadrid
4,march st is nation bieber day wooohoooo like it
4,aaah just got silent hous in the post gonna wait to watch it until tomorrow or sunday though
4,iguana in the desert no shade the sun is high in the sky he can handl it dont bet against him
0,youtubepolit thi is such bsi may not make it to watch bill clinton lay one on fluke
0,without carl nick buc to shuffl olin some major news out of the tampa bay buccan on tuesday afternoon
0,i miss sunday night where mob wive came on then stevi tv would now i gotta put up with thi chicago bullshit and no stevietv
4,let our nov vote be in andrew breitbart name let show he did not die in vain a vote for romneya vote for andrew
4,who want to parti with tay and i saturday night in troy for real though
4,cliff avril say he feel fine follow the bye said he thought he would have play had the lion had a game sun
4,and it final here strawberri festiv today  and tomorrow  thank you god for the answer prayer of no rain
0,premier leagu team done readi for tomorrow bit of a riski tactic that might backfir in week  now to get readi for nfl ff draft tonight
4,a young savag name suadont wright wa born  i love you babi  may your soul rest i miss you donnnn
4,if your ever have a bad day watch too cute on anim planet it all about the st few week  babi anim mostli puppi  kitten
4,maino and the mafia love at infin tomorrow for hustlehardwednesday w
0,silent hous may be one of the worst movi ever
4,west yorkshir polic  cp have advis danni care he will not be charg in relat to alleg sexual assault in leed on march
0,i rate lee dickson but danni care ha to be on the bench sat for the nd test  min with tire leg he will be danger rugbi saeng
4,it will be good for hoop so get readi dec  u kno we will c laker vs heat
4,well it my favorit th doctor stori and it written by dougla adam and if youv ever read the st dirk gentli book of
4,octob   see you sm bacolod   see you there sweet heart
0,kinda piss that i just found out that breakout king got cancel in may taptotweet
0,breakout king went downhil when they kill the black dude first ep of the nd season
0,anybodi want  ticket to jack white tomorrow at alli palli stuck in matlock cant make it contact me
0,just to be sure tomorrow is america day right becaus i dont wanna be the redneck in a sea of god
4,ayup hope all okay were head chester on sat if you guy are free and fanci meet for some lunch no prob
0,dongwoo get so scare the whole time thi is like the th time he got scare becaus of the staff that film them lol
4,check out the amaz world music festiv organ for the th consecut year by rialto theatr in limassol
4,mark your calendar ladi luke bryan will be at the houston rodeo march th then georg the th
4,big day out on nov  galleri hoppingtalksguid tour  more my list of must see gallerieseventshttp â¦
4,rhonda rousey is too good  win in the first round by arm bar she may not be beaten
4,dont forget to drop by the barbican centr conservatori tomorrow for our annual summer read challeng event age  pm free
4,gut decis sharon van etten  cat power elicit emot in me like the st moment i heard trespass william or casimir pulaski day
4,we need some sunday magic like hi  in the final round of the honda classic
0,chester tomorrow for the match with me and shoddi you cool motherfuck
4,sunday dinner mersey side derbi and man u chelsea decent day ahead
4,hey dont forget our show at the rex theatr is sunday anyon want a ticket contact us
4,rd in tabl and look good a great perform today let drag that to the mackem on tuesday utb
4,leovirgo club puls is the move thi thursday leo  virgo are free befor  also cohost by evalesco evalesco will be there
4,next sat kid club film is the lorax with more fun n free activ befor the film from am film
0,not cool have miesha tate the former bantam weight champ on the under card cmon strikeforc treat her better rouseykaufman
4,shock warrior may actual have the best coach staff in the pacif divis gsw nba laker clipper sun king
4,cav  see you tomorrow sa sm starosa
4,make sure that your deck out in your red white and blue tomorrow for america day let make thi homecom week great merica
4,okinawa concert is go to air on  nov hope someon will record it i would love to see seunggi  shinhy
4,also excit to see simciti and bf armor kill dure the confer tomorrow
0,a th grader just told me she got iss today when i ask her whi he told me that she told her teacher that she had a big butt
0,i realli dont want to go to iss tomorrow
0,bharatiya janata parti bjp nation vicepresid gopinath mund on sunday refut rumour that he wa go to join the congress
4,look forward to go to carrow road with my brother tonight coy he mustv forgiven me for my behaviour at white hart lane in april
0,cant sleepwatch stevi tv for the th time tonight
4,i just peed myself anthropologi to open knoxvil store â¦
4,pm readi for repli on coal block congress new delhi aug  ian with the bharatiya janata parti bjp
4,tomorrow is the big day discount price on botox and juvederm call and make an appoint botox juvederm madison
0,im sit home on a saturday night watch silent hous with my parent looooser
4,hi there dj janic can you play cold summer night by franci m in way back wed thi is for you starlight
4,new favorit below the cherri moon from come album brighter out march th  by whomadewho â¦ on soundcloud
4,i recommend go to see behind the mask at laguna hill mall on the th
0,writer motiv dr seusss st book wa reject by  publish befor it wa accept by the vanguard press dont give up
0,i miss it qt  i have got to remind myself to watch stevi tv everi sunday i wa die
0,silent hous may be full of stupid choic that might make you stop care but it highli effect at build
0,harri english a pgatour rooki play in hi first  start hi saturday by plunk a marshal on the head ouch
4,anoth day of iss tomorrow it wont even that bad
4,direction littl thing video will be out at pm uk time tomorrow which mean it will be am in india ill be travel
4,i wish i have the abil to influenc everyon to like rui en hahaa cmon she so cute
4,trill young savag finna walk around the crib nake tomorrow tho best believ
4,just found out that justin beiber is go to be in nyc when you are on long island decemb  i know emma is a fan
4,look like my return flight is schedul for novemb  of cours it subject to chang at least im strand in jerusalem what a citi
0,drexel class are cancel monday and tuesdaynow i just need work to be cancel
4,rememb peopl rui en poeticjustic will debut on  sept  see you again in  month time
4,even though we just play troy thi saturday i still cant wait to watch tennesse play truevolfan gobigorang
4,awesom show today with jimmi bryson tomorrow though we have trent anderson and rhonda rousey also more reo ticket to giveaway listenup
4,direction now we have to prove that we are a big famili on friday the movi to be releas song
4,tomorrow will be play at the strawberri festiv in watsonvil from am  pm come out and support ftd
4,monday is a moon day enjoy a sleepin tomorrow  a littl extra rest come to the workshop with harmoni lichti
4,hello sweeti hope your enjoy your hol found you on here through e l jame im half way through nd bk after daysx
4,may  badhabitz head to chester in appleton wi to rock the hous dont miss thi show
0,i onc turn down a perform david ruffin style due to the venu serv pork sliderslik cmon bro
4,wow i just notic that dongwoo and eunkwang share the same birth date  novemb  omgyu ma awesom biasseu
4,thank brother honestli speak saw you st time with kamran shahid and felt that ik ha made so mani ik like u keep gng
4,went to the strawberri festiv with my babe earlier today and now be lazi mayb a dinner date tonight to top off thi perfect sunday
0,mizzou link  holi smoke it wednesday alreadi i havent even post bill carter sela photo galleri
4,lorenzo brown over taylor ani day of the week  with just as good if not better skill set
0,iebc is readi for th march elect the elector bodi should not be use as an excus to delay poll say chairman
4,hey pamela off to oslo tomorrow then canada after that we will get that drink one day
4,good morn the sun is brightli shine in east york it go to be a great day
0,i just cri over a dead badger name shreddi on anim planet anoth tough friday night
4,isat tomorrow make it or break it for north georgia get a good night sleep tonight
4,oxygen  vh get the most rate on monday night   lol we aint play no game i cant wait till tonight
4,dont forget fca wont meet tomorrow morn we will just meet after the footbal game on the field with sah fca dontmissit freepizza
4,it all about reptil thi saturday novemb rd meet anim planet gator boy enjoy live venom
0,costa concordia accid ship owner say the captain may have commit error  break news buzz
4,feet first ha princetontec headlamp hope to so you all at the young life k saturday
4,on istep i pass math but not english o well i am go to the th grade wooooooooaaaaaaaaaaaaaaaaahhhhhhhhhhhhhhhhhhhhhhhhh
4,ladi will have a free day tomorrow hope they enjoy rest of their time in okinawa miss
4,final saw the stevi tv promo i am so proud of you  march th vh
4,happi birthday wilt chamberlain may you rest in peac
4,amaz that derrick on hi th birthday get call up from the d leagu to an incred franchis like the san antonio spur
0,if plant citi didnt have a stapl i dont know what i would do with my friday night
4,today  is the annual marijuana march in toronto happi weed march everyon in toronto and of cours all
4,ye it is us  black triangl sight in olmst fall ohio on octob th   triangular sape  alien
4,i just had a fantast meal at the love vanessa hous  then off to the middl of nowher aka new hampshir tomorrow
4,diana a celebr is offici open to the public our hour are  am to  pm today  am to  pm tomorrow
4,happi friday we do believ in magic what about you
0,silent hous wa ass when a stranger call wa ass the woman in black wa ass and friday the th is also ass
4,so cycl fan tweepswho is go to win the men race tomorrow then i reckon phillip gilbert or tom boonen swoon
0,dk whi but the rd hospit file not work for me gotta tri download from hf instead
4,saturday night be at the barack shrine in monro  teamlcf gone be in full affect  gsu jsu ull ulm latech letzgetit
4,friday night light west liberti  mediapoli  pull for you comet
4,like the noesenrakellwilson line tonight although they fade a bit in nd half connor carrick wsh and garret meur col good too
4,oii make martin atkinson refere for cfc vs mufc clash on th thank
4,and rhonda rousey ha offici won by armbarfor the th time
0,kurt may have been drug again with rohypnol possibl in the root beer can found at the scene after he wa incapacit the murder
0,anyon go to the romney ralli in fairfax on monday realli wanna go but no car help
4,caraway win by sub in the rd but i still think rhonda rousey could beat him gfyh thaoshow
4,so pump for no school tomorrow and sleep in and even more excit for the hooch tennesse here i come
4,just heard my bud rode with tom boonen yesterday tourofcalifornia goe off sunday
4,andrew breitbart st site wa big hollywood he risk everi penni he had to promot rightofcent artist will to help themselv
4,interview w arni on dinner in mexico with wilt chamberlain and andr the giantmighti collect of fool but admit youd love to the th
4,jesu die for you know you might never love him back that is true love tri wed night game at sjp in jan true love
4,kristin chenoweth say she is glad to be in bethlehem for saturday perform
4,unobscur the sun will shine again stand in your anoint  thi too shall pass see trailer  where to buy bookhttp â¦
4,got a vibe that the mvc is go to be happi with ncaa pair tomorrow  will get in and im start to think wichita st will be
0,ok dongwoo fansit is not accept new member right nowne to regist on the th
4,do rememb thi saturday  tho it a celebr we just tryna have a good time beed
4,i realli want to tweet me sinc i bought  ticket to hi concert octob th irv plaza nyc
0,i have physic revis for tomorrow but merr im go to fail anyway
4,ooshma garg start her nd success compani gobbl watch how she got to one of her biggest investorsreid hoffmanhttp
0,netanyahu new allianc with lieberman may not mean an automat win in the elect
4,if you miss it secret rebel base celebr may th by celebr ralph mcquarri â¦ starwar maythbewithy
0,watch kandi factori dam i could have made the show cant none of them sang lol
0,wichita st with  error in  inning i imagin veteran coach gene stephenson is boil in the dugout msu lead  bottom nd
4,we cant possibl say enough good thing about both march fourth march band and moon hooch link up for
4,tomorrow is the big day see you at bna
4,sufjan steven song casimir pulaski day may be one of the greatest song ever made
4,lol so haryana ha a day off tomorrow becaus it haryana day
4,super excit for homecom saturday with monro my new nephew is here but i cant see him
4,ualr fight off  match point by asu to win  we are go  asu  while ualr  th time is sbc play for ualr st for red wolv
0,wichita st with fundament breakdown in th hall singl harbutz fail to bunt him over hall pick off coy whiff siu lead is
0,the wizard summer leagu team ha their last  st rd pick includ the th overal last yr  rd thi yr theyr lose to the d leagu
4,occupi unmask with andrew breitbart  citizen unit product via happi  cheeri monday lol or no
0,total go to the marijuana march in dt cleve brb not
0,rip runako morton sad day for west indi cricket
0,i gotta pee like a russian race hors at the kentucki derbi on saturday with a truck behind it
4,ne rock okinawa with stylish airport fashion on  octob th
4,mourinho happi with cup win jose mourinho wa satisfi with real madrid  first leg win at alcoyano on wed
4,that it now for  life doesnt star again til  march  when parisnic start tour of qatar in feb is quit jolli though cycl
4,big day in the sun now a big night in the heat with poppinbottl
0,th page in hindu tn edit  gadkari wa on first page though media will one day sell india for bread crumb thown by dynasti
4,im excit for the new tomb raider game even though it come out in march theyr talk it back to the start dont you know
4,salsa sunday just dont stop join your favorit ladi dj ms mar y soul thi sunday at iguana for an even of
4,happi th to hrt we love you shan  tbone
0,your mail monday with fp russia wa such a teas lol
4,cloudi in the valley good luck on your nd day of class see you in the emerald citi isat
0,fraud fear as iebc turn to old poll kit the elector commiss on wednesday said it will take measur to e
4,i wanna see studio footag so bad we are about to hear some unreleas stuff likeeeeeeeee i cant wait until sunday
4,trifecta thi friday get off your butt and come out to hall to show some support as volleybal soccer and footbal take down the devil
0,red cross halt most pakistan aid after behead the intern committe of the red cross said on tuesday
4,my nd time see wa wen me kiaya n chant went to the dc star we stood in line pm n they open the club door at am lol
4,univb ha it biggest weekend of the season so far start tonight missouri state pm wichita state tomorrow pm
0,and tampa doe run a version of the option pass that wsh kill us on rglll to davi may just be replic
4,noth against ecl and isat but it sure is nice be in my own apart for work will be even nicer tomorrow when i set up the desktop
4,interest to see cliff avril start told me wednesday he wasnt sure if he wa readi to go obvious he is
4,finish fill out the fafsa for thi scholarship applic hope it process befor novemb  caus i need it by then
4,smoke a hoya de monterey on the radio glass of red in hand love my sunday
4,im from south africa and will be leav the state on the th of nov realli wanna see jb life would be perfect then
4,dear mr netanyahu if a new cast leadmight be need i wish you success and total victori may the enemi of israel perish
4,think im gonna have to have a maccyd breakfast on the way to spur tomorrow
4,pleas join me in welcom our next us senat from the great state thi come monday check out hrt websit for detail
4,plain rd lot of space in thi  bed  bath home in east york come to the open hous thi sun  pm big space renod bathrm more
0,the sun is just wait for it agent to call to see if it can get the job as the glint in justin bieber eye sun get saad
0,the th album is on it way and we didnt even get a tour for unbroken australiawantsdemi  start to think isnt come
4,sun juli   pm rock n roll the opposit  our greatest hopesa celebr
4,i just realiz that tomorrow is friday which mean tomorrow is the kingsburg vs selma game excit
4,look forward to watch the mackem smash the mag roll on sunday
4,world music festiv is in full swing see you tomorrow even in millennium park with the maria de barro at pm chicago wmfchicago
4,cricket pakistan hope of bangladesh visit pakistan cricket board said sunday it hope to arr f ahsaanu
4,well be at the american women of surrey christma fair on sunday in cobham will sampl pumpkin pie see you there â¦
4,get transcript and shot tomorrow accuplac and group advis turn in fafsa tonight make move befor ny love you
0,just watch the rhonda rousey v meisha tate fight for the st time and that wa one of the nastiest armbar
4,ok i guess i will go see emmyl harri play her album wreck ball on wednesday and so mayb you should also come â¦
4,what a sunday thi could be english to beat the french and wiggo to wrap up parisnic isnt too much to ask for is it
4,not a bad payoff for a nd race trifecta at delmar check it out
4,world music festiv return  free but smaller the good news all event at the th annual world music festi
4,love the greenbrier team tip two of them and possibl harri english biggest fan may yet add him to my stake plan
0,do we realli care about our kid futur think about it educ is the st thing cut from budget on everi level
4,sheffield wednesday link with roger johnson ivan klasnic and michael antonio big coup if they get them massiv
0,damn i have to wait til tomorrow befor i know if i can go to oslo with my si damn im not good at wait
4,sunday mean egg benedict and florentin at the iguana anoth beauti morn come on out and enjoy the pool and  x  bloodi mari
0,just walk past a girl throw her gut up outsid a bu stop averag monday night in shotton
4,will be at irv plaza nyc no doubt will be the th show ive seen so far the band that save inspir and show me life
0,open sourc misconcept fade it web south africa may be up to five year behind the rest of the world in
0,i wanna go to the studio with ulyss n them tomorrowbut i cant bar
4,thank fuck it friday fresh suppli of rohypnolic cold bluewkd in the fridg ani blond think of go out gie a shout
0,just read timmonsvil is beat the crap out of mcbee  still in the rd
4,at least it will make up for the sat and the gonzaga game
4,congrat to ryder cup captain for hi  under  in thursday open round of the honda classic keep it go
4,clipper vs laker tomorrow you all are about to be
0,on mvc teleconfer it seem jacobson found a lot more thing wrong with saturday exhibit after see the tape unihoop
4,space and were the place tonight the sun ra arkestra wa brilliant barbican centr
0,i just finish the th season of armi wivesnow what do i do
4,it okay we gone finish off the spur tomorrow
0,wicket it get wors for the afghan they have slip to  after karim sadiq  wa run out by jo buttler in the th over
0,dana get two fals start call on them tri to punt rd one get return to their  laguna hill score with  sec left up
4,ckt updat pakistan hope of bangladesh visit pakistan cricket board said sunday it hope to from shariq
4,thank to wrh ive got on the guest list for the open night of the shepard fairey show over at stolenspac on friday night
4,the bull head to cle friday night one night doesnt a season make but that wa a solid win over wsh on open night
4,the bull head to cle friday night one night doesnt a season make but that wa a solid win over wsh on open night
4,tomorrow is the day well beat justin bieber vevo record and earn our titl back
4,mcilroy had a strong start in thursday open round of the honda classic but the no  wa upstag by us ryder cup captain love iii
4,haha block by becaus it nd account and he back everyth tom segal put up oh the ironi stoproguetipst
4,look forward to some march fourth march band mad tonight at
0,iebc warn it will revert to manual voter registr if bvr kit delay say poll timet may chang
0,on th anniversari of rabin assassin netanyahu call murder one of the worst crime of the new age
4,i have  pass for looper in pico rivera on thursday messag or text me if you want them
0,serious bum that perksofbeingawallflow isnt play at ani of the base here on okinawamay fli home just to see it
0,dematha wa shock by gonzaga on saturday can the stag regroup in time for the wcac playoff mdprep â¦
4,thursday night footballtampa bay buccan v minnesota vike  vimeo is the home for highqual video
4,cultur down town mon  pm come celebr spanish literatur at world book day by the cervant
4,all senior will be recogn at fca tomorrow and the first  will get free chickfila coupon for free biscuit see yall there
4,a univers uniform in appreci militari veteran he reunit after the game saturday with capt michael p
4,happi th birthday matthew inman seem appropri that you share a birthday with jim henson
4,dont forget to dine out in savag tonight for paa also it america day tomorrow at the hs for homecom week
4,may the odd be ever in your favor australian direction
4,good friday afternoon construct  a crash on the ramp from  northbound to  northbound caus delay head up from brookwood
4,it appear dougla adam may have right about telephon sanitis all along
4,new skyfal trailer is live  fan self is it octob yet i have all the feel for thi goddamn
4,so justin beiber is come down here jan  am i the onli one excit lol
4,big day come up for word from cutom and up is we will have our bounci castl by tomorrow im pray their right ogoplay
4,grab the latest issu of the record out on campu now and stay dri thi morn happi friday
4,will there ever be a rd season of breakout king fx should pick you guy up pleas tell me sumthin good best show ever
0,jonathan clari block punt set up mike longo yard td run and laguna hill cut dana hill lead to  with  left in rd
4,cant wait till sunday morn when we shola make the mackem cri pretti sure a hatembomb or two will be drop too premierpunditri
4,whi you so gwapo  take care mariogo to watch suddenli it magic on tuesday
0,physic tomorrow is go to be a shit show
4,thing i want to do live in toronto to work go to school and pursu act and go to second cityand go out to banff to work in januari
0,dual polici of lpg price not accept to public suggest is that govt should ration the price which may be upto rs
0,vandal in oakland same as the night befor in sf with afghan grown in â¦
0,rediff live hundr of afghan on thursday protest for the first time against cartoon of the prophet mohamm
