0,oh just fuck you  alreadi gt iphon  on schedul for summer launch via
0,no i wont wait until thursday for an avail appoint just so a geniu can tell me im shit out of luck now
0,wtf the new io  doesnt allow you not to get push notif from newstand and siri just keep yap fuck
0,on the ipad with io whi ha the messag icon been includ when it cant be use
0,yea i preorder through and they sorri too just like att
0,interest now requir you to have a reserv  appl iphon s
0,whi is my iphon batteri so crappi fail
0,my keyboard will not type
0,whi doesnt icloud sync sticki theyv alway been around just noth everi progress w them whi appl whi
0,your new save a version function in page is absolut the most aw interrupt counterintuit piec of crap in the world
0,i hate my comput that  dollar down the drain
0,my iphon is charg veri slowli
0,io gm on ipad is veri slow wash better on beta solv thi problem or give me the ipad
0,wish i could pick month day and year when set a new calendar item on my iphon whi hasnt the new io fix thi yet
0,itun is the worst program ever for such a great phone you make some aw softwar
0,one would think the voic recognit on the tech support line would work a littl better
0,to repair my ipad  appl youv lost me and my  a year android here i come
0,proper consolid proper sync stop lose my purchas item checkbox that do what you think they will do
0,the desktop app is wack though
0,i made a reserv and yet i still have to wait in line humpt oh  appl store w  other
0,frustrat that i bought a new macbook pro from onli to find it doesnt ship with media eensivepaperweight
0,dear  i had to turn off all those awesom featur you just enabl data plan cant handl it  mb of data just becaus
0,dontbemadatmebecaus android is by far better than
0,is there a problem with io  that is prevent audio app and audio function from oper properli i keep lose sound
0,appl one thing i hater about thi mous the butteri finish so fast am not happi now macworld
0,hey  stop send your automaticallydepreciatealliphonesolderthanth signal my iphon is die rapidli processorwis
0,onli thing bad about the new camera is that it ha two compact flash card not one of sd sd goe in my comput damn you
0,wtf  page for the new term  condit when u updat ur app from the itun store do u realli think well read em realli
0,fuck u
0,oh and prolli ganna be late to work bc ha screw me and my phone ha my onli alarm on it
0,whi the fuck dose my phone decid it just ganna freez everi time i tri to updat it so fuck sick of
0,if u need me just text me o wait u i wont get it cuz fuck me everi time fuckingpiss
0,imessag doesnt show the time a messag wa sent annoy
0,like da fuck is thi shit
0,im wit chu â offici boycot  call to curs them out next for use them wast my t
0,damn it  whatchu done to my phone
0,samsung seek iphon s ban in japan and australia patent war intensifi with injunct sought against
0,whi is it everi time there is io softwar updat my ipad goe dead and i need to total restor fail
0,io ha been noth but a pain in the ass no room for my music or photo or app can i undo thi garbag
0,i hear you ive had troubl with my   now  ive even turn down bright andshuttingdownru
0,i hear you ive had troubl with my   now  ive even turn down bright andshuttingdownrunningprogram nohelp
0,rememb is evil icloud enter the dropbox market
0,now on my second full charg of the day piss
0,both of them are bs how do u tell me go between a certain time onli and the muh fuh is close
0,im wit chu â offici boycot  call to curs them out next for use them wast my timeâ
0,ugh  youâr reserv page for the iphon is not work
0,itun is s worst product wors than the newton or the hockey puck mous it utterli pain to use
0,deã¡r icloud i hate u  and i hope you die  you are the worst fuck invent in the world  fuck youuuuuuuuuuuu icloud
0,i updat to io  and lose everyth on my phone and it wont let me sign into my itun account thank
0,suddenli lost all address book on iphon and someon wa use my id it all fuck up
0,oh my iphon is overcapac huh  wont let me be great
0,issu with updat itun on my window pc  they realli are not compat sent more time talk to care than use it
0,u guy are gay
0,restor my iphon still no text dear y no love y restrict on my sm y no text io iosatemydingo
0,none of my app work after the new io from  what do i do
0,seemingli endless loop of call to   to investig my miss iphon crankywithnophon
0,that terribl i hope you get an apolog
0,have been on the phone with and pretti much ever sinc then realli annoy
0,i get they are busi w the new phone but i just want to buy a stylu they made me wait forev outsid  never
0,pleas deliv my daughter is she is drive me nut iphon
0,im givin thi stupid reserv system daysâ¦ if i cant get reserv ill never buy ani appl productsâ¦ yup i hate contract
0,still no word on my iphon preorder best buy blame sprint sprint blame  i just want an honest answer help
0,hey  the sm full messag is complet shit ye im annoy
0,have never had such poor custom servic at befor what happen  appl store w  other
0,your servic eerienc is realli fuck slip except for cute eyelash bat girli  appl store
0,had ma ipa not  hour an i jailbrok itnow it shag itun wont letm restor it sym
0,they are then happen and snatch siri so they could be douchebag and say it our
0,what wa think make siri total depend on a network connect siri   utter frustrat
0,wow the geniu bar reserv line is ridic right now   i am not amus ugh
0,where is my iphon
0,batteri life suck on io
0,an appl updat ha seem to render my work machin incap of open hdv video thank  zero use product today
0,i commit to your cloud storag idisk and now it rain so soon no more idisk ani plan for a new servic for storag
0,hey whi cant i share a remind list from my iphon also whi cant i login to the icloud webpag to modifi share from my phone
0,appar fuzzbal crash on io congratul on anoth incompat upgrad
0,could lion pleas integr vertic space in mission control thi horizont busi is make me nauseou
0,can someon plz elain to me whhyy is onli distribut  phone per day to the sprint store im realli
0,gah io  open text messag pain slow on top of  restor attempt  succeed earli adopt get better of me
0,dear  whi did all my pdf and epub file disappear from ibook in my iphon post io upgrad thi hurt gs needsomethingtoread
0,â lie  the batteri on thi new iphon is definit not ani betterâ ltlt check set  time more app usag in io
0,as a huge podcast fan  i realli feel like drop the ball on thi one via
0,i dont realli like siri voic perhap can get star war voic just like
0,â i realli hate deal with the brain dead peopl at the store for such good product custom servic sucksâ in nz
0,i realli hate deal with the brain dead peopl at the store for such good product custom servic suck
0,you can make photo album in the photo app with io  but cant password protect them um  fix that quickli
0,anyon els see miss signal bar on their iphon gs with an upgrad to io cc
0,lie  the batteri on thi new iphon is definit not ani better
0,if you want to know what custom think dont send updat with the norepli return address who invent that anyway useless
0,everi time i tri the voic control on my ipod touch to send an imessag it start play who knew by pink still not flawless
0,should be studi do work but no im hold with hurri the fuck up nopati
0,ok hindi keyboard in io is someth to cheer about but what about support for  miss indian languag fail
0,warn if iphon app spontan loos data it might not be the app fault  iosdowngrad
0,ah yeahshould be an optionhop figur that out thx
0,wait for item to copi in itun after everyth did copi goe on and on and on come on  what the hell
0,unhappi again with serviceproduct qualiti wont buy again
0,lie  the batteri on thi new iphon is definit not ani better
0,â dear  whi you gotta go chang the way ltinput typenumbergt is handl out of the blueâ
0,been on hold with custom servic for  minut wow lt like theyr timewarnerc
0,anyon els stuck in dupe calendarmailbatteri suck hell icloud and osx lion are a disappoint
0,for be the inventor of the comput mous â whi is it that ha never made one that is not a complet piec of fuck shit
0,your kill me excit about io no longer tragic batteri drain geniu bar want to replac the batteri realli
0,st impress of io disappoint w upgrad restor lot of app  folder miss do how much time went in org it fail
0,dont question the they will rememb your dissent
0,multipl time siri is have troubl connect to the network siri need server and some exercis
0,so my imessag still isnt work
0,if doe not resolv the siri network issu they will need to renam a great product to sorri  who els is havin
0,dear  whi you gotta go chang the way ltinput typenumbergt is handl out of the blue
0,ugh wtf is up with all the bottleneck
0,rt  pleas fix siri she cant connect to your network
0,pleas fix siri she cant connect to your network
0,if doe not resolv the siri network issu they will need to renam a great product to sorri  who els is have issu
0,ani chanc will releas good headphon that dont blast music outsid the ear iphon ipod it quit obnoxi
0,siri is not work due to network problem serious can you fix thi iphon fail
0,is cloudi tech not veri techi
0,it ha to connect to to process command which it is fail to do right now
0,see  that what happen when you releas iphon s with same crappi design as the old phone
0,thi rt look like did not appropri project the resourc need for siri not veri reliabl
0,look like did not appropri project the resourc need for siri not veri reliabl
0,spoke to an rep on phone  could hear her tv blare in the bg she said i cant actual help u just direct u back to the web
0,what wrong with siri today
0,siri is down
0,im suspect time the healthdeclin of my iphon  perfectli with the iphon s releas my batteri is serious ail
0,on hold for anoth half hour phone is ring but no one is pick up you stink
0,ok thi softwar updat for the iphon is take waaaaay too long annoy
0,would do better to inform custom properli about migrat to icloud  mani complaint lead to imag damag
0,doe io  rape your batteri life or am i just use my phone a lot sinc get it
0,hope it a small bug must be fix it right appl  itjustwork
0,you do realis your just realli piss off the custom base as well as look petti
0,whi do i have to have app i am updat in their origin folder locat that wa pain
0,domain fail open  hr late for walk in ppl store wa empti and i onli need a skin  my screen you repres custom servic fail
0,the chipset tear through batteri life cowork ha a htc thunderbolt that he get about  hour of life
0,i wish the appl updat would stop tri to ram itun down my throat i dont own a piss iphon
0,is it me or doe my iphon run slower sinc the io  updat
0,just search with my voic on my  year old nexu one
0,your updat server ha been time out for a week i had to forc a restor wthe new io softwar lost all my stuff thank
0,appleupd  success stori iphon  ipad  now been on phone to appl  min ipad  will not wast my time replaceit
0,thank to a  minut wait on hold half an hour actual talk to someon the tech decid to send me an email to fix my phone
0,i am veri upset about and inconvenienc by thi iphon updat fail backup
0,but serious financ me a damn phone you greedi bastard or santaget your jolli ass in gear and get us a s  white plz
0,my schedul is  busi  spend unqual time with  recov iphon againth mo mobil i get the mo immobil i is sync not
0,ponder the io updat from the sound of s difficulti i may just hold off   fix it
0,you know the issu they have with dst and alarm
0,whi book geniu bar if after  hour you still cant be serv disappoint appl store sydney thanksfornoth
0,appar geniu train doesnt extend to clock  servic theyr half an hour late for my appoint and couldnt let me know
0,thank for an os updat that ha onli succes brick my ipod
0,screw you io  i cant download thi crap and im tire of tri get thi problem figur out about my connect time out
0,wow icloud mail is down st the io  upgrad issu and now thi i realli hope thi isnt without steve job
0,whi dont you guy test your upgrad befor you put them out   hr u guy wast of my time yesterday thank
0,what is go on with all my product first my ipad freez still is frozen and then my iphon wont turn on techietroubl
0,ipad in perpetu restor loop after tri to upgrad to io sux without steve
0,nd geniu apptment run late nd day in row for nd dodgi ipod  you make mega  hire some staff
0,it took about  year just to figur out how to properli syncron an iphon wow io
0,so i went to the th ave store and wa told i could wait about  hour to get a s needless to say im back at the hotel relax
0,overal i am a fan of the iphon s howev my siri ha issu connect to the network
0,terribl custom servic at lo gato  whi do i have to pay  for a bad home button on my iphon
0,thank you for suck so much i cannot believ you would sell someth onlin that isnt made
0,have major batteri drain issu sinc updat iphon  to io  anyon els
0,dear pleas send me my mac book back sure the repair is done by now thank
0,io on iphon caus camera apperatur dilat problem  freez
0,io geoloc suburb with  word drop map pin in other state pleas fix
0,sorri  but imessag will never be what bbm is disappoint
0,iphon s siri doesnt work for shit
0,clarenc thoma must have design the new osx lion toss decad of workflow standard bring back âsave asâ autosavesuck
0,yeah except that when you ask for a receipt it take them  minut to figur out where it print out fix that
0,hey do you wanna fix my fuck playlist order you piec of shit
0,bummer my  ipad fantasi footbal app keep crash not sure if it the app or the new io  onli two app run
0,can suck my dick gotta restor my ipad annoy
0,the line at the is just stupid
0,man that sux io upgrad a total fail for you
0,dear contact you are terribl i just clean duplic for  hour and they magic reappear fix it
0,is it too much to ask which app is incompat
0,piss with whoever design keyboard with for not have a home and end key work on the cli i use those key often
0,most of mine are gone too not recov after i save them b i upgrad my iphon soooo piss
0,hey do you wanna fix my fuck playlist order you piec of shit
0,siri is have a hard time rememb who my sister is contact card need space for famili info iphon
0,io get sloppi  u need to check your qa team too mani issu with app data and sync
0,so thi sm full messag is known issu with new io updat tri restor when all els fail  restor
0,so glad that i paid  for thi care protect plan been on hold for over  minut now great custom servic not
0,not happi with right now the upgrad to my itouch took out my itouch and laptop help
0,all i can say about right now is goodridd â see cancer isnt all bad
0,can you look at problem on ipad where it wont open messag it just crash the app you too mayb your fault
0,what the point of icloud wireless updat when io now forc me to use the comput to charg my ipod touch now worstupdateev
0,no worri bud ps theyr say that the s is have a lot of network issu right now im for mac problem
0,i hate you for not send toledooh ani for even after i pre order
0,if my nonappl equip broke thi often i guess id need an asu geniu bar but it doesnt so i dont
0,whi is the new iphon os duplic all my ical event there  of everyth how do i fix it tri turn icloud off
0,dear  how convenienthandythoughtfulsmart that after iphon io updat your app wont work anymor none grmbl
0,hey i know steve job die  all but my twitter for ipad app keep crashingfix itnowpleaselol flight
0,not happi with appl today i did the suggest softwar updat and now noth work
0,smash yet anoth iphon screen when are gonna make the phone more durabl tire of fix it myself
0,io ha one problem when i save someon in my contact they dont show hi nam becuz of the region  appl
0,i sure as hell better be abl to restor my calendar event terribl bug appl icloud anothericloudfail
0,i realli hate that wont let you hide the newsstand app or move it into a folder it serv no purpos for me
0,life wa much easier when and were just fruit
0,no locat remind on ipad that wa the point of updat to io
0,compar live with app and icloud  i do not see icloud lead the crowd do you agre
0,turn out my comput isnt as fix as it is meant to be fuck you  im go back to your geniu bar to complain annoy
0,if doesnt fix io thi week im buy a droid emptythreat
0,pl launch siri on iphon  disappoint after spend hour for upgrad to io
0,you can suck it you and your fuck iphon better be glad it all i like caus the servic is fuck terribl
0,thi is the first time ive been unhappi with ani product disappoint and the internet seem as confus as i am right now
0,after a week or so with s io im consid go back to jailbroken   same featur as  plu more not as stabl though
0,had issu with siri reach network today too mani use or my signal
0,the new io complet fail at upgrad the phone now im stuck in thi restor loop thank for wast my day can i undo
0,is it me or doe iphon run a littl warm sometim
0,wtf whi can we not add the newsstand to a folder we are alreadi in your wall garden so pleas dont remind us of it
0,just now see none of my microsoft offic program work anymor after lion upgrad whi
0,dear  i dont want the newsstand icon on my screen notcool
0,doe take better qualiti photo than iphon though i give them that photograhersey
0,ok idk wth is up but after sync my phone my album art is out of order wtf
0,i wish siri could tweet for me  fix that
0,im still wait for you to deliv my phone to
0,i will never purchas anoth product for the rest of my life i am glad steve job is fuck dead may you fuck rot in hell
0,thank to my new imac is a brick i cannot reinstal lion and i cannot purchas it becaus it wa instal by the former owner
0,ask siri where babi lisa and wa told sorri im have troubl connect to the network right now server fail io
0,onli thing io ha done is delet my tiger wood game and made imposs to retriev thank
0,damn you for break wififofum it continu to work in io  wa one of my most use app damn appl overbear polici
0,yo  thi updat is a disast
0,dear congratul i am su my insur compani and you just manag to make it to the top of my shit list ineedthosepictur
0,dear  you must let me turn off icloud to save bandwidth and not delet everi document on my ipad that bullshit
0,dear  it me again thank for beauti new io featur but i miss some of the old one lk make call  text gt
0,by far the worst eerienc upgrad out of ani version of io io
0,what happen rt  never purchas anoth item from
0,never purchas anoth item from
0,wow worst custom servic eerienc ever arrog and inept bad combo biltmor appl store
0,wow worst custom servic eerienc ever arrog and inept bad combo biltmor appl store
0,hey guy at  wtf is happen to iphon with io suddenli fade to black and begin to vibrat continu i had to reboot it
0,whi dont you play nice and let me use hdmi from ipad pretti lame
0,warn if iphon app spontan loos data it might not be the app fault  iosdowngrad
0,dear  it me again thank for beauti new io featur but i miss some of the old one like make call  t
0,â¦and onli the first  imag in my photo roll made it over serious  how did you fuck thi up so much
0,whi doe iphon plu io equal half the batteri life
0,whi isnt my itun updat i just wanna updat my iphon to io then itun say that it need to updat to do it then fail
0,now wont let me use credit on unless i have a credit card should have told me when i redeem the card sound fair to you
0,siri ha work for me less than  of the time if servic doesnt improv by monday im return my iphon s
0,rt  and again mobilem is down issu when sync access mail is thi a good premis for icloud
0,need help instal new io on iphon and am stuck on the find my iphon screen i keep click next but it doesnt work
0,bummer that icloud sync on window onli w outlook not thunderbird  ie not firefox chrome sadmac
0,you heard of test befor deploy updat differ between microsoft  appl none
0,disappoint visual merchandis  simpl but lack eleg and sequenc doesnt even tell us about siri
0,ha been on termin hold with support she must not be the onli person have troubl with the new iphon and synch
0,thank appl for io  and lose all my contact
0,give me my app back
0,io nonstop drop callsmut button randomli activatingperson cant hear me pull phone from ear to be on a mobil me screen
0,didnt it occur to appl that ppl share itun account amongst famili  wtf
0,epicfail
0,minut after be at  my iphon  post io upgrad ha lost  of it charg and the store folk are out of idea
0,so cut the cord make podcast even harder to manag no subscript wth  io via
0,rememb when peopl use to say flat the fuck out lol and their face while say kindahow i feel about
0,in less than an hour my post io iphon ha gone from  to  batteri charg and the store folk have no solut for me
0,well seem b screw iphon s resellar they still dont have s yet were promis similar  ma bell monopolist prctice
0,also  dont forget stop close the app store after each bloodi purchas
0,cu
0,sigh store seem stump what to do about my catastroph bad batteri life after upgrad to io
0,hmmmm a lot of siri featur dont work in canada locat and direct serious come on
0,siri cant connect to the network  it less use that voicecontrol now
0,took my siri and made it exclus to iphon s sorud
0,total time on the phone with   hour  minut let see how thi goe
0,wait in line for noth fuck geniu call an app for john not jean stop fuck up my name im not a french boy pcam
0,dear  one day your go to releas a version of itun that doesnt freez more often than it work one day
0,it been hr sinc i report theft of my iphon and ha done noth no return call as promis noth
0,thi doe not bode well after charg all night my iphon s ha  batteri after onli hr off charger with no call  light use
0,houston we have a problem my ipad ha been restor for  hour after instal io thi cant be right
0,siri went down for a littl while last night come on  get your shit togeth on thi launch
0,should have team up with instead of to make thi sync system in my new focu car is sweet sync is epicfail
0,instal io  fine on ipad but wipe wife iphon and restor from backup fail bigtroubl help
0,realli  what have you done to my itun now i cant click on music movi tv show or ani playlist i get a l
0,damn you
4,took me month to decid but tonight i have chosen googl over amazon s for imag storag solut
4,today the day ic lt android googl samsung
4,the new nexu look good ui feel a bit confus but i guess android user are ok with that now tri it googl android nexusprim
4,veri nice trivia game by googl help you use their search better
4,veri nice trivia game by googl help you use their search better fb
4,cant build a websit get a googl websit free
4,android ic is look pretti good not quit sure if it worth the  number leap googl
4,googl it
4,android  ice cream sandwich is here with a googl nexu in new avtar android googl nexu bigmama
4,me too rt  excit day it ice cream sandwich day googl android
4,wow the new googl nexu is just beauti total gonna boost googl market share in the smart phone market
4,hahaha integr data usag manag in sucha brilliant way sleek design superb and im onli watch video lol googl
4,i fanci an ice cream sandwich googl android wonder it will work on my htc desir
4,googl ice cream sandwich  sound yummi what do you think googl android ice cream sandwich
4,googl me
4,excit day it ice cream sandwich day googl android
4,android  ice cream sandwich is here with a googl nexu in new avtar android googl nexu bigmama
4,i wa refer to googl  icecreamsandwich it look amaz what imo android wa miss i
4,forget the phone nice ui like the scroll featur android googl nexu
4,simpli amaz googl samsung galaxi nexu prime android icecreamsandwich
4,googl ha final unveil the much await android os ice cream sandwich  it sure look good
4,googl final all search for log in user will be on http
4,rim should realli take an in debt look at googl strategi they releas the ndk for icecreamsandwich  hour after releas ic
4,man ive fallen in love with galaxi nexu googl samsung galaxynexu android
4,when in doubt googl it
4,greader share five reason whi googl is win the war in photoshar  photographi fotografia googl
4,dear googl i want the galaxi nexu now pleas send it to me by email or someth  i know you have the technolog
4,telegraph report that the biggest threat to facebook is it power user have shift to twitter or googl httpt
4,sorri appl googl and samsung just made you look bad android is king
4,telegraph report that the biggest threat to facebook is it power user have shift to twitter or googl
4,facebook power user have gone to googl and twitter  telegraph who are they socialmedia
4,not impress much with the new android updat but good sign a readabl font emphasi on design and less nerdi googl
4,video googl wallet see the wow effect
4,when im about to tweet someth and i cant rememb how to spell i go straight to googl
4,dear googl i want the galaxi nexu now pleas send it to me by email or someth  i know you have the technolog
4,googl android  out avail with samsung nexu
4,mayb not the most effici way to brows but fun googl releas an infinit digit bookcas by
4,it difficult to pass up googl consid the social seo benefit of googl vs facebook
4,ice cream sandwich to stop carrier bulli smartphon user googl android
4,i agre with that the hangout on googl are friggin awesomeâ
4,ice cream sandwich to stop carrier bulli smartphon user googl android
4,googl galaxynexu icecream great
4,the next googl nexu phone is here
4,googl earth help locat salmonella hotspot googl
4,thingsweallh that person that act like they know everi fuck thing bitch you not googl
4,samsung galaxi nexu  orbit laser appl iphon s  wooden stick googl
4,want googl nexu samsung galaxi
4,ice cream sandwich u r realli delici can ditch iphon for u that for sure googl launch android aka icecreamsandwich
4,googl  lovin it
