4,yeaa rd place congrat end of the game indonesia warrior    singapor slinger thank for the support superrior
4,tonight a show in dc tomorrow greensboro nc it been too long sinc ive perform so exit to see everyon and play the new tune
4,sandi ha pass by and the cathedr close wa onli lightli touch whew so ye nc will be open tomorrow
4,get the skinni on metropc launch the galaxi s iii on octob  price is  good news for metropc custom
4,pacer extend their biggest lead of the game with a paul georg jumper up  pt  with  left st half
4,rum chata hot chocol thin mint and netflix thi is how you do saturday
0,god he a daft thing he merlin is not veri bright sometim she circ appar sat there wash her paw ignor him girl
4,so glad im not go back to woodland tomorrow look forward to joseph wright
4,wow  just found out that jeff timmon will come to malaysia on  oct for a week  hi wed ceremoni will be held on the st in kl xx
0,if got a pimpl the size of jupit th moon on my forehead fml
4,there is still time to regist and find your red dress for tomorrow rampag get on it
0,mommi said i have to go to maxwel monday  lmfaoooo the fuck i dont
4,so excit for these upcom show it time to get halloweird tomorrow night the fox theatr w
0,st time i bring my phone to harold washington  it goe off
4,trayvon my daili tweet  in memori of trayvon martin  kill  day ago may you rest in peac we must never forget you
4,im go to watch eurosong croatia is th so vote for croatia
4,â¦ ani joey fan that want a cover for all nn win may take thi
0,i never had a good time i sat by my bedsid with paper  poetri about estella
4,happi monday stop by volar tonight for roast duck half roast crispi duck serv with babi spinach and
4,sat in a boozer in bethnal green listen to the dj play  i think i like it at about bpm
0,you may find thi hard to believ but viola davi wa a troublemak back in the day see
0,giant rdround pick fail drug test at nfl combin jayron holsey knew it would hurt him bec newyork sport
4,my mom under the hilari impress that im spend my saturday load  unload furnitur from trailer in natchitoch
0,polic fear ivan leach also known as lee cyru carri out a veri seriou sexual assault in taysid scotland sinc he abscond on oct
4,imagin danica and daniel meet on friday and the feel you get to say that you help out amaz jbmeetdanica
4,it monday night footbal wrangler nation game time pm vs the wichita wild get your ticket now to cheer
4,celebr saturday  thi is great tea good have around especi if you are go to be at the oscar
4,were excit for trunk or treat tomorrow nov  night at the boy and girl club in pottstown it will start at
4,i cant wait for the sunderland vs newcastl rd best derbi in england after manchest and north london derbi id prefer a newcastl win
4,i want to be here the greatest hit tour  blue jeff timmon of  degreesa on feb
0,not here in the east thoughmoon jupit capella light up even sky on novemb   tonight  earthski â¦
4,glad im go to greenvil tomorrow night tho
4,mayoroflondon join in tomorrow at the excit london children book swap event for famili who love to read ld
0,sonic on ost is the worst place in rd ward
0,abc ricki pont and luke butterworth made wednesday a tough day at the offic for south australia in their sh
0,i never watch the oscar but with seth macfarlan host i may have to activ campaign to get other peopl to not watch them either
4,are you all readi for roger sanchez thi friday at hq nightclub hmu at  for tabl reserv and detail
4,the donkey show  friday the th is an excit day for the adrienn arsht center of the perform art in
4,special confer call tomorrow the th at  pst   est featur doug wead doug is go to give us a
0,keith richard mean noth to monday night and is aw cant we all just forgiv hank jr
0,greatw had ticket to see the pred on the th  now the game have been cancel nhllockout
4,come join in all the fun at the great pumpkin hunt at rosedal garden thi saturday
4,fuck stoke to hang out with my girl thalia tomorrow night havent seen her in age
0,forget the garlic the soup is disgust thank for noth saturday kitchen
4,there are still spot avail for happiest babi on the block thi sunday
4,lipa  beat the bad weather join us for our taster session wed and thur at joseph wright centr
4,im happi my st show is at pm today ritz carlton let sell it tomiroseteam
4,grassroot race at it best return to marana on saturday octob  at the gladden farm k an
0,it offici i will not be fli to raleigh nc tomorrow im sadden i pray my uppc famili ha an awesom time in the lord pray
4,track texa am footbal player in the  nfl draft texa am may have the biggest surpris of the  n
4,just watch the pursuit of happi for the st time i love it good deed by tyler perri is the girl version
4,wow ladi gaga is actual at the britney spear femm fatal concert tonight she still listen to her music wow
4,mail in a lather over cs schedul of four lion to coincid with th anniversari of  too good a film for stunt schedul i think
4,realli enjoy pj harvey tonight  contrari to eectat even the black feather headdress wasnt too ott
4,my dad just told me he realli want to go see final destin  on friday wow wasnteectingthat
4,rt wonder compani and gr food in chinatown last night with tour guid   iren
4,have you watch four lion saw it again last night love it fuck mini babybel
4,dude you definit need to get a part in true blood we had pole dancer again thi year at the uk convent parti tonight
4,got email say my copi of deu ex is on it way if it arriv tomorrow i will liter stay up all night play it no joke
4,tomorrow is the elvi extravaganza tune in to fm at am for all the elvi presley you can handl it gonna be rockin
0,listen to ami and lucien attempt at commun on last night big brother  i fear for the futur of mankind sometim
4,bois state chattanooga embryriddl and virginia tech receiv their charter tonight congrat and welcom gentlemen duli
0,if anderson silva doesnt win tonight yushin okami wont make it out of brazil aliv
4,ahhhh love thi new ic champion wish i could see it happen thi friday  cross my finger that he ha a match at summerslam
0,look at the temp outsidehpw did it get hotter as the sun goe down feel like im in vega just ad humid
4,cant wait for septemb th the new season of son of anarchi start woo hoo
4,six good review for the new deu ex im go to preorder it today ive seen enough coverag to know it go to be worth a look
4,tomorrow is the th anniversari of elvi presley death i love you rest in peac
0,terribl tragedi today in russia with the loss of a great khl team and an nhl great in pavol demitra
4,nd goal barcelona would be proud of cleverli isnt the futur he the present sneijder come soon rt pleas
0,whi horribl whi doe the rugbi world cup have to be here in octob im gonna be battl my bday soul punk and peopl run in circl
0,i cant believ aaron carter is come out with hi th album tha carter iv
4,almost forgot about celebr juic tonight oh my what time is it on at guy
4,dri by pj harvey is a brilliant record i listen to the whole thing yesterday on a break from edit filmmak
4,wwooo fasho u know i gotchu ima c u in vega on the st blud
4,day  in the big brother hous and it ingleton waterfal trail today promis some amaz sceneri
4,cant wait to rock apolog by one republ  jesu freak by dc talk tonight gettin redi to rock sasabo japan
0,boehner want presid to chang speech to thur instead of go against gop debat what same time as packerssaint nfl open
0,realli hope tonit lloyd robertson will ask us to goto the window and yell im mad as hell and im not go to take it anymor lloyd
0,i would be surpris if tha carter iv wa anyth greater than shithop im prove wrong but the st  singl are doo doo
4,cant wait to see my raven beat the steeler tomorrow
0,boehner tell obama that sorri the hous is all book up for sept  mayb you can come anoth day
0,gavin henson look set to miss the rugbi world cup after disloc a bone in hi right wrist yesterday
4,tomorrow is gonna be like the super bowl for the raven vs steeler game
4,just preorder the droid bionic pick up from the verizon store next friday  brevard nc
0,onc again democrat spent all night and thi morn tri to talk down the stock marketwhatev happen there can be no blank check
4,yayyy rt   nicki minaj  pink friday up  place to  on the offici uk top
4,you know what vampir diari start in germani on monday i cant wait
4,great gametremend way to start the season bring it on and next sunday real madrid v barcelona
0,leagu rt  i just found that barcelona and real madrid are play on sunday i need sleep pill
4,deu ex exclus hand on articl go up tonight fuck love you twitter follow
4,all of the real democrat won their respect race  will move on  face the  recal republican state senat on august  yeswecan
4,go to see rise of the planet of the ape tonightoh yeah
4,hope pj harvey take home the mercuri tonight great record
4,loool errr ill have to it watch it today wa watch celebr juic last night
4,august th rt  cant wait to see the inbetween movi will ha to be my favourit when it out
4,bois state chattanooga embryriddl and virginia tech receiv their charter tonight congrat and welcom gentlemen duli
4,i would love to watch vampir diari tonight and some hero great combin
0,i dont feel the rugbi world cup fever via  am i the onli one isnt it rugbi friday
4,best thing about thursday is celebr juic
0,cant believ that lloyd robertson last broadcast is tonight end of an era who is gonna keep my grandma compani at night
4,been tri to decid on a new show to watch  alway get ton of son of anarchi suggest i may go  it have a bless day
0,whi did i just hear some car drive slowli down th street blar elvi presley
4,good morn yuki oh i like your name too doe it mean snow riko isnt my real name ive chose it becaus i like japan
4,he a veri good look guy is s on netflix i think im watch it tonight
0,strip club owner guess well make  time as much a night  republican got plenti of money they take it all from poor peopl duh
4,saw at last kung fu panda  yesterday with my cousin
4,she call me babi i call her bae sorri  the wait carter iv on the way august th hellllll yeahhh
0,displeas with lion i may take thi opportun to learn window  or linux or poke myself in the eye
4,morningit all system go for the weekpaytim and deu ex out later in the week thi is truli biwin
4,is stadium kanyi open tomrw for the open ceremoni and ab vs tonga game i happen to be off duti tomorrow
4,my brother gf is on me to use her netflix acct becaus i love my movi so ill all for give it a tri tonight
4,morn gorgeou u were rite i thought it wa bslisten to thi nicki minaj did hhave domesticshttp â¦
4,can silicon valley recharg solar energi silicon valley innov appl and googl may be the best hope left
4,vampir diari and jersey shore tonight so first we see some hotti then we fist pump with hotti sound great
4,look forward to celebr juic tonight
4,lol look for the bright tiger wood not hard to miss me today
4,we love the king  year ago today elvi presley releas hi doublesid hit dont be cruelhound dog
4,i love you all so much come join us on saturday even for the uga v bois state game game is at pm but we
4,nicki minaj  pink friday up  place to  on the offici uk top
4,four lion watch it on channel  tonight at pm best film ever i have thi on my ipad never tire of it
4,droid bionic thi thursday never thought the day would come
0,dont want to play one that too long what with street fighter iii rd strike on wednesday and deu ex human revolut on friday
0,thi tweet wa poorli time sure theyd be hidden rt  handi tip for window  that you may not know
4,im not go on holiday until the th becaus me and my dad want to watch the inbetween movi when it came out lol   georgia
0,one million peopl march in london in the past six month but they dont care until  tottenham tonight  â¦
0,obama goal is to lead us into rd world statu so your absolut right obama doesnt care
0,damn someon save holder from the earthquak technic dont know whi wbiden out  obama alway out boehner is rd in line
4,im exit about friday no offens but who is tonga nz cant just make up name and countri play fair
4,morn all just woke up to madonna on the radio with borderlin cool
0,no way to underestim the mad and cynic and frank and open loath of countri that character today republican
4,excit for the raider game tonight
4,after a day at the lake me and my girl are get readi to do vega big tonight bless freshtodeath
4,excel perform by pj harvey last night hair on back of neck stuff good compani too with  and andrea
0,he may be that but obama spent  billion a day after get uncl sam credit card in hi hot littl hand so it all fit
4,today veri rare day when democrat will get healthier on their club for growth scorecard than most republican
0,caught the repeat of jersey shore tonight and the damn wall knock out  wtf cmon bro are you seriou right now
4,some good televis tonight gonna get on jersey shore on the planner and  out of ten cat and mayb red or black lazynight
4,i swear my facebook wa elod thi morn boom all over the fuck place remind me of four lion
4,kolchak the night stalker befor the xfile excel scari tv on netflix huzah
0,the gop greatest crime  boehner propos obama speech be on the same night as nfl open night
4,eh emattent true blood is on tonight oh yeah sink ur teeth into it lol
4,today veri rare day when democrat will get healthier on their club for growth scorecard than most republican
4,inbetween movi a week today aaaahhhh might wear my welli to the cinema caus ill be knee deep in clung
4,the mta will be at mondawmin metro station from pm today to celebr the baltimor grand prix well have a race car for you to see
4,final wrap up shoot in vega time for a good night on the town
4,im go on big brother bit on the side next tuesday i thought you would appreci thi haha
0,usa golf today bob ryan tiger now a jag just anoth guy bob ryan of the boston globe call tiger wood
0,ftrain wa mess up again today between york and carrol stwhat go on mta get it togeth
0,here is the nip slip that happen yesterday on good morn americaand nicki minaj is not happi but abc ha
4,i hope notr dame win tonight and the steeler win tomorrow
4,sonni bill william name in the first xv to face tonga on friday thi man is one to watch my other is isreal dagg rwc
4,good night michael jackson i do love you see you in my dream
4,start the rd season of son of anarchi i watch season  and  in the last coupl week  im serious hook
0,if fabrega doesnt goto barcelona thi season he may never make hi dream switch with alcantra alreadi start to seal hi posit epl
4,watch the vampir diari from the begin a classic saturday night and with lolz
4,final destin  august  death how weve miss you
4,good luck tonight the teen choic award i know twilight is gonna take them all ill b watch
4,hide in countri club all u want boehner reverserobocallcom launch soon  im one of st in line join me launch
4,glad twilight night wa a success ill make it to the next one sorri to be the lameo
0,omg realli anyth microsoft keep fuck freez on my machin what the fuck today is not the day for thi shit to happen
4,girl sing the nation anthem tonight is a bois state student i gave her a go duck befor she went out didnt seem to faze her
4,it almost pm in japan nowhehehbut good morn to you too
0,my random rant of the nightladi gaga be consid a fashion iconwho in their right mind consid that fashionsh dress in trash
4,good morn world im pleas to inform you that the carter iv will not be like watch the throne
0,dont do it he wont respect you rt  boehner ask obama to move speech to thursday
4,i know one thing i can do tomorrow write a blog post about my newli discov love for vampir diari
0,the mta should be pretti embarrass tonight
4,cant wait to see the anderson silva fight saturday woop woop
4,the raider need to repres tonight
4,the brilliant drew westen offer a great critiqu of the obama presid â¦
0,gavin henson look set to miss the rugbi world cup after disloc a bone in hi right wrist yesterday
0,ru show the all black v tonga game friday nite with the sound up definit not show the leagu right rwc
4,nicki minaj flash a nippl on good morn america youlv gotta see it afghan say so
4,good morn need a googl  invit i have a few plusinvit love to see the gtchat folk there
0,critic of rick perri is ridicul which choic obama hiphop barbecu two day ago or perri pray for the presid today
4,vega here i come yeah watch out la vega the bring back the brown sd is take over at la vega next week and tomorrow
0,re what the heck wa obama do for the st  year when democrat control everyth
4,nice disagr of cours he sat down with boehner onli thi
4,omg i cant wait to see what beyonc is gonna do at the vma sunday august th
0,is it april fool day real madrid sign yearold argentin prospect leo  espn
4,true blood tonight alway the best night of the week
4,steeler fan are awesom just for that im make it my mission to piss off a brown fan today hehe inspir
4,good morn it definit time  a new phone alarm clock ringer isnt go off anymor tryin  wait on steve job befor i make a move
4,fun night tonight at vampir diari great teen choic award winner
4,everi time i dont have anyth to do ill watch the show i stop halfway lol and it teen top mta today
4,fun date night with my girl home earli ice my ach bodi wish i had netflix right about now
4,gym workout start with beyonc then katykyli and final bruno great start to the morn
4,i knw my ish kev hart voicelol happi sundayrt  lolrt  if kevin hart make u
0,haha wa it as bad as your night in barcelona with the bucket o chund
4,hook on son of anarchi thank to it too good too stop watch all day view today
0,what if cena win the undisput wwe championship match at summerslam thi sun a riot is veri like to take place
4,hope u have a great show tonight me  the chiin girl are so excit to see you in london tomorrow
4,inbetween movi come to cinema in ireland on the th of august i have never want to see a movi so bad shouldbegood
0,check thi video out  obama sarkozi cameron how mani children did you kill thi night â¦ via
0,im on that zan with that lean and nun but iren today at band camp ju to laugh at these poo ass freshman snare drummer
4,i went to see kevin hart and still cant wait to go see the movi on the th
0,russian air crash kill almost all of khl team pavol demitrakarli skrastinsruslan saleibrad mccrimmon among the dead may they all rip
4,is all about one night by elvi presley
4,so amaz to have the beauti ladi gaga at the show in ac tonight love you girl britney
4,ufc  thi sunday from am  anderson silva v yushin okami  dont miss it in the sport bar live
4,as good as the fight were tonight im glad thi one is over one day closer to see anderson silva clown a massiv asian man spidersens
4,jerzday tonight first episod of jersey shore season  premier tonight
0,dang forrest didnt get it done  he wa our last american hope tonight oh well now for the main event anderson silva vs yushin okami
4,nw kung fu panda  dnt judg me i like anim movi plu the st one wa the shit
4,raini day got alot done tho registr tmrw morn rdi to eat din and watch son of anarchi cant wait for the new season stoke
0,absolut gut wish i could watch rt lloyd robertson set to end year run as nation news anchor tonight
4,i saw okay movi there friday nightris of the planet of the apesi still like conquest
4,after an almost year career lloyd robertson broadcast hi last sept  he join us next
4,at da end of da night no girl that roll with me is on da mta they are abov that as long as i can afford that
0,veri jealou of the ridicul adventur is have tonight while i just sit at home watch big brother
4,dont forget to look out for me and in the audienc of celebr juic tonight bangtidi
4,nw true blood cant wait til the new one come on tomorrow
4,look forward to the new jersey shore start tonight ha it start in ireland yet what do tweep think jerseyshor
4,caught up on true blood i love it now time for bed night peep be safe tonight
0,watch last week jersey shore last night you put your own head into the wall serious crazi atleast ronni didnt
4,congrat on the new contract and good luck tomorrow in bmore go steeler
0,sad news today what a great player rt  pavol demitra ha die in the russian plane crash
4,just in case you need some inspir today steve job  stanford commenc address via
4,to anyon plan on watch the teen choic award tonight spoiler alert the winner are justin bieber and twilight
4,excit to go see rise of the planet of the ape tonight
4,went to see rise of the planet of the ape tonight it wa pretti dope i give it  banana
0,is it just me or is googl app email just plain slow today
0,what annoy is that the one i preorder just came todaystev job just loot my card
4,a win for either metronomi everyth everyth or pj harvey would be a satisfactori outcom for tonight mercuri award
4,off to learn about googl analyt today i hope it doesnt get too technic look forward to it though
4,is about to go see the help cant wait for final destin  on friday
4,good morn america of nicki minaj wa great when she perform moment  life nickiminaj
0,then idk he danger we in a whip full wdealsweapon  beyonc new cd  night almost kill me im n self preserv bro
0,conrad murray claim mj wa unabl to sleep the entir morn yet murray wa on hi phone all amdo that make sens no
4,child like excit build ahead of the rwc think my nd team is go to be tonga loveabitofbiff
4,yassss deu ex is actual out th august that brighten up my day a bit
4,must get all my work done and ahead with clean my hous befor pm so i can have a night in with the son of anarchi
0,if the iphon doesnt come out on septemb th im su steve jobsi cant put up with the motorola razr much longer
4,sold out tonight charli sheen cake parti marco hanna live with dudu sax
0,i want to see eb but idk dont look to good guess ill call it a netflix night
4,devo brown thank for anoth great night everyon dont forget tomorrow roz and mocha speak with lloyd robertson  jason priestley
4,im so pump for jersey shore  tonight i want and vinni to hook up
4,nowplay elvi presley love me tender  just as good as version at solu cardiff in novemb
4,it  am  i have to wake up at  in the morn to sleep or to keep watch jersey shore to sleep nah i think ill stay up
4,off to see the nokia n tomorrow itll be like be a real consum tech dude again also off to an event at the new win store
4,who want to go see beat canada rugbi team tonight in glendal co send them off to the rugbi world cup the right way
4,tgi friday wa good go to the move to see rise of the planet of the ape
4,morn all anoth day at meet the star of true blood autograph and photo for me today onc the vodkafug ha clear
4,celebr juic tonight pm itv hurrraaaaah it a back to school special
4,just found out that the new season for vampir diari come out sept th
4,nokia n in nine second by ian post on the th of juli  at am global  the nokia n is fast so fast that a regular s
0,oo well unfortun youll prob need at least one of those if you come to london in late oct
4,i guess im go to watch anderson silva whop a nigga ass while drink grey goos tonight
4,im realli die to hear that track with beyonc and the full version of that my bitch off watch the throne monday must come sooner
4,charli sheen seem pretti confidentbadass for hi upcom roast he actual seem like he ha it togeth i may watch
0,rt whi doe steve job hate you your link â¦ car perform my best friend girl need flash to play
0,yesterday is the day the atom bomb in japan i embarrass as a japanes wa a moment of silenc for the first time
0,let see what shitti movi netflix ha recommend for me to watch tonight
0,uhoh  you must have loath my apart  whi didnt madonna have her outburst in juli
4,final watch last week true blood readi for the new episod tonight how is everyon els thi morn
0,today is my birthdayth anniversari of the death of elvi presley and the birthday of madonnai wonder if ill be famousino talent
4,congrat to client for hi tv debut on big brother bit on the side last night analys social media mention of housem
4,anyon els alreadi get goosebump about how loud goodnight iren will be at  tomorrow afternoon blackthornendmyrealhom
4,day lefttim is tick downtonga should start get worri  just kid may the best team win tomorrowgo black
4,the brilliant drew westen offer a great critiqu of the obama presid â¦
4,kick off the world cup friday all black vs tonga yeeeaah im so look forward to just lax back popcorn  a glass a bubbl
4,realli look forward to the releas of deu ex hr on friday just annoy that north america get it tomorrow
0,perhap a bit insensit show the film four lion in the run up to the  th anniversari justsay
4,well sinc it been the th here n japan  over  hr id like  wish my bff a grand th sad i cant b there wyou
4,bring it on rt  kung fu panda  will releas on tuesday  august
4,walk through chelsea at thi time of day is rather love love london at night
0,pray no one get hurt or kill in london tonight guy thi look like it gonna go on for hour
0,facebook scam say ladi gaga dead  realbollywoodcom news london aug  a scam do the round on
4,we all went to see rise of the planet of the ape last nighti actual enjoy it a lot that chimp caesar wa a great actor serious
4,britney ladi gaga here tonight me what watch gaga the rest of the night  me who concert wa that  i forgot
0,crap i meant to let oomf use my microsoft offic thing for their comput todaywel hell get it one weekend when we both in town
0,my soup just blew up in the microwav and elod everywher so far today ha been a bigger bitch than madonna is to hydrangea
4,oh my gosh that hilari  love it did you read the one on steve job love the tuesday read
4,prayin for the famili that lost someon today in the plane crash pavol demitra one of my favorit player rest in peac
4,watch the best moment of inbetween last night highlight the fact that towi is full of helmet sure im not the onli one
