0,iranian gener say israel iron dome cant deal with their missil keep talk like that and we may end up find out
0,talk about act  sat decid where i want to go to colleg appli to colleg and everyth about colleg stress me out
0,my teacher call themselv givng us candywasnt even the good stuff i might go to walmart or cv tomorrow
0,homegrown talent miss on sign day throughout most of the day on wednesday the video scoreboard  raleigh
0,damn next saturday tho nigga wa trynna get shit over with earli
0,nigga be on the laker dickw still gon finish damn near first seedwhil yo team be struggl for the th spot
0,appl ceo apolog for errorridden new map app appl ceo tim cook apolog friday for the compani errorridden new mobil map
0,esper will be without star player youssef msakni for the first leg of the champion leagu final against al ahli on saturday africa
0,the sun paolo di canio say beat aston villa tonight would be like have sex with madonna legend
0,obvious i am not a fan of dream high  and i havent even watch it well i watch the st epthat where i heard that song
0,upset alert in acc men soccer  maryland down  to wake forest late in the ndand down a man after an earlier red card
0,realli bore of thi host on super sunday do noth but talk and rave about man utd biasprick
0,that crazi im more jealou of u go to joe pa grave i wa sad saturday when i walk past where the statu should be
0,with all benson attent franki feel like a forgotten stepchild let found father him so he know we will never forget nd place
0,polic protest clash at republ day march in turkey on a day mark the th anniversari of the found
0,the glass may be rise but it not get ani warmer here lago del desierto argentina
0,i may be the onli girl on the face of the earth that doesnt find chan tatum attract callmecrazi justsayin donthatem
0,give me  min with candi the dancer from deja vu im nut on my th pump she that bad lol
0,honesti is often best polici fabio capello russia coach i wa hope ronaldo injuri wa more seriou so he couldnt play tomorrow
0,thi is austin river st game and peopl suck him he a rooki chill
0,axl rose need to just give up now not later not soon not tomorrow now
0,i wonder what cortes is think after watch that st half of total wank as for boruc you are a disgrac and a complet twat saintsfc
0,how mani contin wa the challeng film on  okay what did you fail nd grade
0,ive been on tv a few time now still wait for the call from itv about danc on ice though start to think i may be too famou
0,i feel do bad my boo asia bday event mayb cancel for thi sunday i wa soooo look forward to it
0,kobe in the th is like eli man bewar
0,scariest man aliv kendrick perkin is close nd  ray lewi is probabl the onli human be ever not born with an indoor voic
0,will you have lunch with me tomorrow nightrandom hoe that hit on castl nooooooooobeckett
0,work almost over with then these negro wont see my face till monday night
0,rd and goal at the  and river throw a int terribl pass by river  bad decis cost u game geez half time sd
0,fabio capello russia headcoach wish cristiano injuri wa more seriou russia will play against portug tomorrow in the wcq
0,i think i may be the onli person around not excit that beyonc is the half time perform for the superbowl
0,the fact that i have no plan tomorrow night  it my last night in fl for a min
0,news releas  octob  custom of the negro subgrid eerienc a partial outag today at pm cont
0,i do worri about the mental of the averag tweeter when i see jeremi kyle and christma trend on novemb st
0,a betray wife is legal allow to kill her adulter husband but may onli do so with her bare hand hong kong
0,nick diaz said he would fight gsp tomorrow if the ufc ask except you know they wouldnt becaus your suspend
0,protest against the mitch daniel purdu presidenti nomin tomorrow loeb theater  pm bring a friend soapurdu
0,watch my favourit behind the scene for the th time when jennif hudson goe awol excus me what the hell is go on
0,nfl commission roger goodel say he may cancel the pro bowl would you care if there wa no pro bowl
0,were eerienc some issu with fuel tv ch  should be back up friday or monday
0,is it evil to laugh when a rd grader read a short stori and at least five time mistak the name becki for blocki stickingtoit
0,visit to iran by five euro mp wa call off sat after tehran refus to let them meet with a jail activist
0,nigga wa realli on some th grade shit tonight
0,toi israel admit  kill of arafat deputi israel for the first time on thursday admit respons
0,get on februari for valentin day the suav fucker
0,buffalo bill kyle william miss practic thursday for a second straight day buffalo bill bill nfl
0,i go on channel  to see what the weather is gonna be like tomorrow and taylor swift sing eewww getoffmytv
0,miss those day  when all the rel would just gather at th uncl hous and celebr chines new year  i guess itll not happen agn
0,on octob   i told taylor swift i wouldnt listen to her until she wrote about someth els one year later and here we are still
0,oh and rafa said befor the injuri he wa have the best year he ever had wa st in the race m
0,of othersjenel may have made mistak but she ha time to chang and be a better personit too late for youfuckhead
0,rd mariah song of the night and nooooooooo that wa so bad xfactor
0,im not gon believ that victor cruz is the real deal until he line up outsid no slot and doesnt disappear like he did sunday
0,shouldnt have watch the grey last night becaus walk down a dark driveway when the sun decid to play hooki is not a good time
0,nigga boutta be droppin like fli down georgetown tomorrow  you wont catchh me there
0,so i heard my old crush is go to the bell game tomorrow and wanna talk wtf weird
0,and then both team took dump in the nd round of the big danc ku flame out against ucla mizzou lose to northern iowa
0,cupid did so much work da st time that he dont wanna be my friend no more
0,i will not be abl to handl harri voic in kiss youand i may not surviv after hear all the song on take me home in their entireti
0,damn i dont wanna get on my comput tomorrow my harri feel are out of control and the outtak video broke me
0,happi valentin day is trend  but it not even februari
0,kendrick perkin may have the worst goate in all of sport
0,friday cnet updat is play one republ  appl ceo say sorri for io  map mess appl ceo tim cook ha said he wa extrem sorr
0,gop ha set the bar veri low with a th cycl promot a grossli unamerican idea potu as elect autocrat civic
0,cant wait to hear tomorrow cmag meet about horni coni  report baag wait  watch you will be grill tomorrow  cmag a hope
0,thi bitch just put frog back on lmfao throw back thursday
0,no you may not kick it tribe call quest answer a text from billi cundiff
0,my bodi is exhaust i walk from th and jefferi to the lakefront where i accident sat on dead fish to th and king dr and back
0,and to the  girl in front of us that sat down and play templ run the whole time whi did you even come confus
0,too soon amazon open black friday deal store thanksgiv is week away the world seri onli end on sund
0,im assum that heb ran out of candi and peopl decid to give out pizza instead becaus it wa busier than super bowl sunday today
0,in  hour i know if im gonna see the boy live on may st omgg im sooo scare for tomorrow
0,lorenzo beasley he wa kill on juli th of last year on the corner of rd and king dr mile
0,watch the vow for the th time and im still tear what wrong with thi movi it tooo omg i cant even
0,realiz that ive just spent halloween super bowl sunday and my last two birthday either in the librari or in a comput lab
0,as a point flacco had a  qbr last sunday even vet qb had a bad day
0,fuck you band that cover it on friday night and fuck you ricki martin for exist in the first place you big jerk
0,cofield should have hop off the dm stick after hi rd year nigga wa tire of him lol
0,youd think after not repli to the rd text the twat face would get that i fuck hate him
0,lmfaoasdfghjklomg i just saw a pictur of jenel from the st day of school in th grade damn that nigga chang
0,serious all of you peopl are dumb say that all of the school in cni are go to be close tomorrow
0,have to say i think jason  taylor may have been rob by the marri duo tonight of blake  miranda
0,nd night parker ha been on it boy oh boy
0,refus to admit that it rd year bring on my groundhog day
0,omg the music video come out tomorrow btw i still cant get over harri voic  â¦
0,gov mitch daniel is ralli republican with a rare appear that may have violat h
0,i alway cri wen i listen to avril sing tomorrow in dublini just rememb everyth bad happen to me
0,and on tuesday harri redknapp distanc himself from the job follow specul he wa plan talk with the club
0,thi may be a reason to swap io ha too mani daft game android is a desol wasteland when it come to game â¦
0,alright if my daughter keep sing avril just to annoy me i may be forc to retali
0,nd come will black america debat the  elect bet im tire of hear ppl say potu havent done anyth  blk
0,sandi if you have ruin my chanc to see bruno mar on monday i will go buck wild
0,art  do you think nyc should host the marathon sundaywhi would they when soooo mani desper need helpwher is respect
0,ladi gaga fear classmat lo angel nov  ian singer ladi gaga is still in touch with some peopl from h
0,wait if the power is out tomorrow then im go to miss a new how i met your mother nooooooooo
0,terribl play call on nd and  victor cruz on a slant te nick sidelin how about ani of those
0,embarrass ram cut alexand ye i know he from mizzou but cmon chief d make unknown look like pro bowler
0,so i have a red eye flight home from ca sat night at am pst w layov in dalla on cst along with the clock be push back an hour
0,fox chicago you make me angri play the vike vs redskin over the nfc championship rematch er vs giant tomorrow
0,ladi gaga fear classmat lo angel nov  ian singer ladi gaga is still in touch with some pe
0,capello bemoan languag barrier in russia russia coach fabio capello spoke monday of hi frustrat at the la
0,i notic all the huddleston hater were conspicu by their absenc yesterday particularli when he assist bale for the st goal thfc
0,our wacki wednesday promo is go a bit ground hog day i say our our wacki wednesday promo is go a bit
0,what wors than be stuck in a time loop of groundhog day be stuck in a monday loop
0,if jenel come to the game tomorrow ill die missherlot itsbeentolong mybabi
0,ryan go to amsterdam tomorrow wahhh but who the fuck even goe there
0,out castl sun and stay there until tue mother said it aint safe up dere in that new york wit sandi all thru dere fvck you sandi
0,becaus yall have been compla about him allll the dam time not like me sinc i wa in rd grade parker ha been my main babi
0,so not an over the top comedi ashwni dhir mumbai nov  ian forthcom comedi son of sardaar might be
0,smh im just wait on the black ppl to cuss me out tomorrow about denzel lol nigga
0,appl ceo extrem sorri for problem with new map sourc  sunday septemb
0,haha you know i cant deal with athen after last saturday hear their ignor ass talk about the game lord help me
0,oiler fan are unhappi with  point each season gagner as their nd line c hab fan should hate  point eller as a c
0,fran say paterno wa veri congeni to the media in hi earli year age  perhap betray by media may be part of hi rift with media
0,cmon guy fix thi pleas i dont want thi to end up how diablo iii did
0,seem my new ipod doesnt like kasabian veri much laptop ha crash everi time it got to sync empir th time lucki
0,im go to the duke game on saturday haha duke whata joke they are
0,monta elli commit hi st foul he cold with  miss ft a foul and a miss to start q buck trail bull  mid q
0,nigga is have th grade fight on here you in high school i cant even deal
0,okc thunder center kendrick perkin may miss the preseason due to a wrist injuri
0,thi is ball shit becaus i broken my ankl on sunday at footbal the armi wont let me in for year thank callum twat
0,do some seriou suck up tonight so i can go harri tomorrow
0,the boy s calvin watkin elain whi sunday night game are bad luck for the cowboy and
0,no favorit for russiaportug clash  capello moscow octob  ria novosti  russia match with portu
0,activist demand releas of jharkhand tribal leader new delhi nov  ian condemn the arrest of woman trib
0,acta get the ax wrote about him and other manag on the hot seat on tuesday
0,did you see that andi carrol header what techniqu cmon that not techniqu techniqu is pass the ball  yard  time
0,unless you got a throw back thursday pictur with michael jackson i dont give a fuck about your faggot ass pictur
0,bale doesnt celebr hi goal but race over cuddl dempsey on the nd illustr perfectli the bullshit spotlight whore they are
0,sunday is turn out to be the day when i play templ run social life is a joke onli forev alon lvl
0,stop that my dude dook footbal even the sun shine on a dog a some day unc
0,born in februari close to valentin through all the heart pain i still look for love guess imma alway b crazi
0,i realiz bellami is a freshman qb but the play select leav a lot to be desir option toss on rd and  cmonman
0,aston villa are a joke mate and so is your profil pic u may wanna hit the gym b u head to the bridg w your bitch slap jogon
0,she said that some day soon the sun wa gonna shine and shecouldnt have been more wrong my valentin
0,awwww shit i still got some new amsterdam in the fridg mmhmm tomorrow after work ima need that befor i go out
0,how are you spend your saturday night im current sit cri my eye out to the vow
0,all i can say is that it wa veri unrealist the st movi wa betterstorylin dialogu and of cours the grey thumb up
0,tomorrow is last day for earli vote in nevada i am not inspir to vote earli i dont like mani of the choic most suck ball
0,cant watch rafa ill be back video til the end it too heartbreak plu it just remind me he wa up  in ao th set
0,austin river is overr i dont see how he came out in st round
0,they should make februari th desper day
0,it seem like it nation kiss day everi other thursday who tf made that shit up
0,centr suffer from polici paralysi alleg jayalalithaa jayalalithaa on tuesday charg the upa go news
0,ghost rider  is pretti shit i like the st one in all honesti but the nd is badli direct the shaki camera style is disorient
0,new shit  thing to know for friday the us postal servic on the brink of default on a second new swag
0,the us postal servic report a  billion quarterli loss say it is nearli out of cash sat mail will be gone veri soon
0,nobel peac laureat jose ramoshorta warn monday that syria risk becom a new somalia as he voic pessim
0,extra point is no good it dsu  morgan state  with  left in the rd quarter
0,i keep think about the fact that mmg will be in lexington on saturday and i wont be there
0,so june th is the day thi is gonna be wors the the galaxi foam
0,i certainli wouldnt be spend my hard earnt take the kid to see say shel nd xi v us club will fold no doubt
0,watch the wiggl for the st time wa embarrass for those men  then i rememb that they are probabl filthi rich parent
0,madison dont wipe your black line off  it like ash wednesday you dont wipe that shit off
0,how have i miss that today is nation margarita day kinda doesnt go with ash wednesday
0,are you come to nz tonight or tomorrow morn waaa im so confus
0,cmon leo where endymion or amsterdam i know he like amsterdam those song are shit compar to the one i put
0,dr jan radio ue tonight with david oldfield re kevin rudd sad loss of famili cat pet deserv honour co they love uncondit
0,i guess knicksheat is on for now pretti clear that tomorrow game wasnt go to happen
0,mncim the rain that stop last saturday game wast our time waits mayb ss would be play someth better tonight
0,valentin day ha been cancelledwhat whi how you may be ask but you see it simpl math
0,lack of commun from nycdo veri frustrat regard report time for work tomorrow thank you uft and for info
0,centr for social justic report on gang  one year after the riot â¦ d polici may have exacerb problem
0,i havent worn makeup sinc ash wed  i dont like it anymor
0,monday morn caltrain ride from home to work is alway to short i know that i may be in the minor with that opinion fb
0,rudd rain on abbott parad kevin rudd may be tri to spoil julia gillard parti but yesterday he gatecra
0,whi these mf ju blastin rella like itz the hood on saturday n shit lolz smh
0,they stop film the butler tomorrow and i still havent found alan rickman elan he been film that movi here in la
0,just watch project x for the st time im unamaz yall hype it way past what it wa
0,st of all in my world there onli good n evil real ppl n fake mfsthi is whi i realli feel jlin wont make itnot durabl like yao ming
0,interview at kfc tomorrow how the fuck im go to understand a singl work said idek i hardli understood the interview set up
0,navi rabbit in for spay on tue and she just had a phantom pregnanc what time thi mean day of bunwatch and raspberri pi no citi
0,shit go down thi sat at neighborhood theatr dropthard
0,it age sinc i had kfc well apart from the mush in a bun that pass as breakfast last sunday that doesnt count though
0,anyway sorri for these random tweet about the finder unfollow for the night ill be back to normal sport stuff tomorrow
0,the big l is strictli gunplay i run thru church n pistol whip the priest everi sunday damn
0,golf capsul nick watney miss a chanc for a  on sunday in hi cimb classic victori close with a cours
0,the onli thing i may truli miss about lexington is shoto
0,knick vs pacer in the nd round of associ mode upset the  bull
0,thi nigga just hit a full court one hand shot with brook lopezsmh st birthday shit
0,ghost rider spirit of vengeanc wa a lost caus you had nowher to go but up after the st movi and then you decid to dig a hole
0,so disappoint with the movi ghost rider spirit of vengeanc so not better than the st ghost rider movi
0,in lewi on the th theyr burn effigi of guy fawk the pope  whoever els they present dislik sussexi inde
0,final saw the galaxi foam in person on saturday let just say  smmfh ugli ass shoe
0,and also havent been abl to check and cba updat sinc sunday if anyon hear ani news pleas pass it along to me thank
0,i wa definit hype for that knick and net game tonight  give brooklyn they st l fuck you hurricanesandi
0,i had a nightmar last night where i miss the nd rd of my fantasybasketbal draft and they autodraft me jr smith truestori lol
0,if you call me good girl one more time you may find my scold hot coffe head toward your crotchal region
0,khader exist isra high court will hear case of khader adnan on thursday that may well be too late where are the protest
0,not abl to watch the enril documentari but ive a sens he yet again wont like tomorrow inq editori
0,whi doe the knicksheat game have to come on tomorrow night dure biblebal oh well id rather play than watch ani day
0,you know what i dont give a shit about tomorrow yolo
0,valor video shoot tomorrow night hope it stupid creativ
0,bought tix for sat net game b price jumpd and allowd seller to reneg wo proof the tix arent avail poorcustomerservic
0,my sister just sat up and ask where kati wa go to sleep she is a littl too old for an imaginari friend dont ya think
0,go to tri  watch act of valor for the nd time the part i seen are pretti bad ass
0,i spoke too soon flight just cancel look like im strand in calgari ill tri again tomorrow am eek i hope i make it iycsask
0,caltrain just cant catch a break mt about  am train  struck a femal on the train track south of th street
0,nba the brooklyn net open vs the new york knick is postpon it wa origin schedul for thursday even
0,centr suffer from polici paralysi alleg jayalalithaa jayalalithaa on tuesday charg the upa governm
0,luca scott cmon whyd you die your hair
0,machin gun kelli concert on the th me  bout  shut thi bitch down
0,im in hawaii at the moment home next friday night dont want to come home
0,after i tweet about gari carter photo facepalm they remov the met photo nd choic almost as bad kid hold met cap
0,real shit ray allen meet with the knick tomorrow
0,migrain sinc saturday  a blood vessel burst yesterday in the eye where it locat ani more and ill be rock a mari colvin eyepatch
0,august th  wa the day i met mitch i regret not take a pictur with him fuck ill miss go to ss show
0,laker fan should take it as a sign that they got beat by the sacramento king twice in the preaseasonand their starter play the th
0,ash wednesday is alway hard for me ani day focus around ash on your bodi bring back bad memori for me
0,i cant forgiv farrackhan for the malcolm x thing and ninja aint done sht sinc the million ninja marchnam one thingwher the
0,i may do a mile bike ride for the giant on wed caus you know caltrain is go to suck more than the cardin
0,if you dont know he the vocalist of the metal band lamb of god and is a sorta a rd parti candid
0,cmon dont play with the winan
0,disappoint the knick vs net game got cancel tonight but im even more hype for knick vs heat on friday
0,they tri to pull a fast one and say today is margarita day but that is fals we may be drink margarita but it is not margarita day
0,careless world tour hit up  place in cali haha the fuck yoo
0,no knick tonight thi make me upset enough that i havent tweet about it you know shit gotta be real smh tomorrow night knicksheat
0,holger may have anoth select headach with carl valeri come off with a possibl injuri after  min in tonight game v cesena
0,miss hootersmi husbandmi lifemi photoshoot tomorrowguess im gonna drink thi bottl of wine with a xanax and pass the fuck out bye
0,thi is the st halloween my kid didnt go trick or treat kinda sad they are too old for it now cuz i
0,okay if you go to elon univers and do not go to the ripchord concert saturdayyour sin
0,kevin rudd talk about pm betray  updat  sunday oct   senior labor mp are again bat divid
0,fyi wednesday is go to suck on caltrain if you even plan on go to work that is parad
0,hey mr ego octobergari carter  kirbi puckett are hofer as are youth differ isthey were class actswhich you arent
0,ecuador worri about assang health  ecuador say it is concern about the health of the wikileak founder jul
0,we alway get push out to ss with ben sheppard could be wors could be thursday night with colin murray afc
0,ume follow dont forget umesvolleybal take on morgan state today at  be there or be realli bore cuz it a sunday your choic
0,bad news no gibb for saturday unless we play tv at lb we have lost befor it start santo is a liabil and will be cut to shred
0,i think i may have spent too much on carmelo anthoni i onli hope that hi thickfram black glass will consol me in the postseason
0,doe everyon not realiz the voic is rig ie cassade pope sang in the sign band hey monday or dia wa half of meg  dia
0,play jacinto on gear on guardian fer the st time nd it rain wth
0,how can you hate on yolopleas tell me how live your nd time is
0,wow tiger fire a  but not good enough nick watney shoot a  if he birdi the th sick
0,if barack obama care  the peopl of nj he would lift union ban like georg bush did day after katrina sandi octob fail leadership
0,thi time tomorrow and i will be well on our way to starkvil for a sick weekendth usm game is go to be atroci
0,khader adnan may be releas but the struggl continu  palestinian are on an open end strike as of today to mark prison day
0,a th journo murder in somalia  tokyo  unveil stadium design rival whi madrid say it need  olymp
0,tough one tonight for the boy play hard but came up short with a  loss with an eng davi score the lone goal la rong tomorrow
0,whi is my mind do thi to me st i think about max and how he alway know when im sad and now i think about what happen when he die
0,akin and murdoch are scum but rape joke arent much better brah they may just be just a cont
0,he doesnt deserv the death penalti a la todd bertuzzi but i think  game is fair if not whole st rd
0,vitali klitschko stop manuel charr in the fourth round to retain hi wbc world heavyweight titl saturday night eotpro
0,i just came back from mexico citi i will fail  subject for not go to school for a week if rih come to mexico in the th omg
0,wish i wa go to the rodeo tomorrow night with everyon stupid surgeri
0,i can talk about malcolm x all day like when i got kick outta school in th and th grade for be too radic about black panther
0,ignor again man c v ajax itv tue celtic v barca ski wed sort it out ya fud
0,the heat is gunna kill the knick tomorrow
0,bill murdoch may have apolog for say what he said but he hasnt chang hi view on the matter
0,i cant believ the  import peopl in my life are go to hawaii friday without me
0,ramdev jail aid pic with freedom fighter at ramlila new delhi aug  controversi erupt at the india
0,rdm serious believ last night prove sunday defeat wa unjust if anyth im surpris our first xi didnt twat you on sunday
0,simon crean still cant support the way kevin rudd wa spill from the role of pm  herald sun
0,bear with me for the power crisi jayalalithaa chief minist jayalalithaa on wednesday ask the peopl of tamil
0,horribl dream ladi nightim tier but today is my friday and it the start of the rodeo tonight hearthors
0,these peopl cannot know who mick jagger isyou aint old old skool mayb but cmon mick jagger ha a lot more year than you
0,okay im sorri but taylor swift look noth like jacki o so stop compar the two cmon america arent you sick of her yet sorri
0,im go home and throw thi up my diet start tomorrow
0,ghost rider  is out on monday ignor it
0,ghost rider spirit of vengeanc wa a lost caus you had nowher to go but up after the st movi and then you decid to dig a hole
0,o johnson commit hi rd foul he cold off the bench with  foul and a turnov in q pacer lose   left
0,st star review colour of lemon set off like a bullet train with the gruesom murder of one of sowerbutt own
