0,wait comedi central isnt on freeview is it also love that i predict thi last night
0,so we arriv in scotland yesterday and it hasnt stop rain sinc and to make thing wors it sunni at home typic
0,alabama got a huge commit today but doesnt know it becaus theyr all too upset over sheridan admit noth
0,michael just heard green day time of our life for the st time sinc leav florida and i burst into tear i miss penderg
0,blow to the lionsjoel patful out for the season after break hi hand in sunday loss to adelaid surgeri wed morn afl
0,i wish i wa in bolton tonight
0,big brother start tonight and x factor on saturday wish i could emigr or hibern
0,yeah i know what you mean spent too much time catch up on dexter today
0,i want sanchez to go away and have mota be th starter
0,it look like a beauti night to throw myself off the brooklyn bridg
0,same way as in bolton are be stubborn and not talk or demand a stupid fee  are you eect jim to sign today
0,topic on the morn news doe detroit need a white mayorpausewtf
0,who start colleg on th it like prison on independ day thought she just yr elder den u
0,the zombi would have been wors the ad for walk dead s wa play all night dure famili guy creep me the fuck out
0,off to scotland today for the week so ill miss the wankfest at wembley utd
0,desean jackson suppos to be at train camp on mondayhop the eagl lock him up and extend mike vick
0,sanchez didnt know plax would sneak in for a play yesterday i wish i would have hit him he said got pressur by d nyj
0,famili guy is on some other crap tonight
0,well hell im drivin by myself in nebraska tomorrow whi do i get the feel that thi will not end well
0,hello there i hear that the stink work classwer riot in london last night do you see whi im in itali bloodi rif rafhear hear
0,after lose  last week today the gop is tri to win  senat seat in wisconsin by recal  democrat it look like theyll fail
0,amanda knox who lie repeatedli  clean with bleach that morn is no innoc petal
0,not sure if i want to go to eng v holland game on wed onli got ticket coz of arsen player might not featur now
0,it mexican sorri for the late answer ipad charg fuck me yesterday
0,the safest place to be in tottenham tonight is the spur trophi cabinetther no chanc of looter visit there
0,tragedi struck and collid in my sport world today as mikel leshour blew hi achil wa on the lion and my fantasi team noonecar
0,toni romo better be on point tonight dont have time to deal with hi foolish
0,i lost respect for annahazar the minut he sat at duratma gandhi graveyard yesterday india doe not need anoth gandhi vandemataram
0,america got talent semifin begin tuesday we want differ singer than american idol and x factor said
0,i realli hate to think it but the same type thing that happen to miami could happen to alabama tomorrow
0,obvious were not look great right now but the arsen will finish th predict is wrong everi year
0,dope night with the eagl did sangz tell you he delet all the pic
0,i may have just thrown a lime at an nfl player apolog forthcom ivaluemylif
0,tuesday will be my last day in florida
0,mail on sunday cesc fabrega is so desper to leav arsen for barcelona that he ha offer to give up more
0,rt  iebc may hold the most modern  credibl elect but that wont stop kenya from burn again if the intoler we
0,cliff avril leav detroit lion game with back injuri detroit lion defens end cliff avril left sunday ga
0,how im go to miss senior year selma vs ktown game friday cuz i have work
0,the nd game unit lost wa away to chelsea martin atkinson wa the ref then and some of hi decis incur the wrath of saf
0,heart throb might not make it to my st sike better watch out world courtney here  no one stop me
0,long day work g meet marijuana march and aveng all sick nonetheless
0,afghan protest against french cartoon us film hundr of afghan on thursday protest for the first time a
0,turn out have less than an hour unbroken sleep leav you feel pretti grim on a tuesday
0,uniontown all readi ha a  hour delay tomorrow smh brownsvil is gonna be the onli school that dont have shit
0,star war visionari becom one with the forc artist die at  star war conceptu artist ralph mcquarri w
0,st david pleas just cancel school tomorrow i realli dont feel like die in a hurrican
0,im sad my short dont smell like vanessa anymorei sat there snif it cuz it smell like her i need her to wash it again macandchees
0,idc anymor everyon leav me alon at school tomorrow im go piss
0,tomorrow will mark  year sinc the wichita state footbal team plane crash happenedoctob  silver plumeco  lost their live
0,real madrid coach jose mourinho face further select dilemma ahead of sunday la liga trip to real mallorca with sami khedi fb
0,sreven taylor will look pretti daft after the mackem win tomorrowi realli think they will beat youparmo
0,oslo ha been gloomi the whole day am ok with the temperatur but not the nonsunni outlook hope it get better tomorrow
0,so you want peopl like chief keef  ted nugent to have gun cmon son debat
0,the school are also in the middl of istep test so they may not be abl to get back to you yet
0,that girl rhonda rousey is bad and she got  ws all by way of  st rd arm bar badass
0,nd zen dixi if you dont read  share god will kill a babi kitten i will haunt you w redund  bad pun
0,ugh had iss today  gonna have it tomorrow too  gay
0,simciti delay it availabilityhttp â¦
0,correct march band is cancel tomorrow whi in the world wld we think they had common sens to cancel school so earli duh
0,if the world end in decemb imma find justin beiber and castrat him befor i die
0,youtubepolit thi is such bsi may not make it to watch bill clinton lay one on fluke
0,without carl nick buc to shuffl olin some major news out of the tampa bay buccan on tuesday afternoon
0,i miss sunday night where mob wive came on then stevi tv would now i gotta put up with thi chicago bullshit and no stevietv
0,premier leagu team done readi for tomorrow bit of a riski tactic that might backfir in week  now to get readi for nfl ff draft tonight
0,silent hous may be one of the worst movi ever
0,i rate lee dickson but danni care ha to be on the bench sat for the nd test  min with tire leg he will be danger rugbi saeng
0,kinda piss that i just found out that breakout king got cancel in may taptotweet
0,breakout king went downhil when they kill the black dude first ep of the nd season
0,anybodi want  ticket to jack white tomorrow at alli palli stuck in matlock cant make it contact me
0,just to be sure tomorrow is america day right becaus i dont wanna be the redneck in a sea of god
0,dongwoo get so scare the whole time thi is like the th time he got scare becaus of the staff that film them lol
0,chester tomorrow for the match with me and shoddi you cool motherfuck
0,not cool have miesha tate the former bantam weight champ on the under card cmon strikeforc treat her better rouseykaufman
0,a th grader just told me she got iss today when i ask her whi he told me that she told her teacher that she had a big butt
0,i realli dont want to go to iss tomorrow
0,bharatiya janata parti bjp nation vicepresid gopinath mund on sunday refut rumour that he wa go to join the congress
0,cant sleepwatch stevi tv for the th time tonight
0,im sit home on a saturday night watch silent hous with my parent looooser
0,writer motiv dr seusss st book wa reject by  publish befor it wa accept by the vanguard press dont give up
0,i miss it qt  i have got to remind myself to watch stevi tv everi sunday i wa die
0,silent hous may be full of stupid choic that might make you stop care but it highli effect at build
0,harri english a pgatour rooki play in hi first  start hi saturday by plunk a marshal on the head ouch
0,drexel class are cancel monday and tuesdaynow i just need work to be cancel
0,i onc turn down a perform david ruffin style due to the venu serv pork sliderslik cmon bro
0,mizzou link  holi smoke it wednesday alreadi i havent even post bill carter sela photo galleri
0,iebc is readi for th march elect the elector bodi should not be use as an excus to delay poll say chairman
0,i just cri over a dead badger name shreddi on anim planet anoth tough friday night
0,costa concordia accid ship owner say the captain may have commit error  break news buzz
0,if plant citi didnt have a stapl i dont know what i would do with my friday night
0,silent hous wa ass when a stranger call wa ass the woman in black wa ass and friday the th is also ass
0,dk whi but the rd hospit file not work for me gotta tri download from hf instead
0,kurt may have been drug again with rohypnol possibl in the root beer can found at the scene after he wa incapacit the murder
0,anyon go to the romney ralli in fairfax on monday realli wanna go but no car help
0,ok dongwoo fansit is not accept new member right nowne to regist on the th
0,i have physic revis for tomorrow but merr im go to fail anyway
0,netanyahu new allianc with lieberman may not mean an automat win in the elect
0,watch kandi factori dam i could have made the show cant none of them sang lol
0,wichita st with  error in  inning i imagin veteran coach gene stephenson is boil in the dugout msu lead  bottom nd
0,wichita st with fundament breakdown in th hall singl harbutz fail to bunt him over hall pick off coy whiff siu lead is
0,the wizard summer leagu team ha their last  st rd pick includ the th overal last yr  rd thi yr theyr lose to the d leagu
0,total go to the marijuana march in dt cleve brb not
0,rip runako morton sad day for west indi cricket
0,i gotta pee like a russian race hors at the kentucki derbi on saturday with a truck behind it
0,th page in hindu tn edit  gadkari wa on first page though media will one day sell india for bread crumb thown by dynasti
0,your mail monday with fp russia wa such a teas lol
0,fraud fear as iebc turn to old poll kit the elector commiss on wednesday said it will take measur to e
0,red cross halt most pakistan aid after behead the intern committe of the red cross said on tuesday
0,and tampa doe run a version of the option pass that wsh kill us on rglll to davi may just be replic
0,the sun is just wait for it agent to call to see if it can get the job as the glint in justin bieber eye sun get saad
0,the th album is on it way and we didnt even get a tour for unbroken australiawantsdemi  start to think isnt come
0,just watch the rhonda rousey v meisha tate fight for the st time and that wa one of the nastiest armbar
0,do we realli care about our kid futur think about it educ is the st thing cut from budget on everi level
0,damn i have to wait til tomorrow befor i know if i can go to oslo with my si damn im not good at wait
0,just walk past a girl throw her gut up outsid a bu stop averag monday night in shotton
0,open sourc misconcept fade it web south africa may be up to five year behind the rest of the world in
0,i wanna go to the studio with ulyss n them tomorrowbut i cant bar
0,just read timmonsvil is beat the crap out of mcbee  still in the rd
0,on mvc teleconfer it seem jacobson found a lot more thing wrong with saturday exhibit after see the tape unihoop
0,i just finish the th season of armi wivesnow what do i do
0,wicket it get wors for the afghan they have slip to  after karim sadiq  wa run out by jo buttler in the th over
0,dana get two fals start call on them tri to punt rd one get return to their  laguna hill score with  sec left up
0,iebc warn it will revert to manual voter registr if bvr kit delay say poll timet may chang
0,on th anniversari of rabin assassin netanyahu call murder one of the worst crime of the new age
0,serious bum that perksofbeingawallflow isnt play at ani of the base here on okinawamay fli home just to see it
0,dematha wa shock by gonzaga on saturday can the stag regroup in time for the wcac playoff mdprep â¦
0,jonathan clari block punt set up mike longo yard td run and laguna hill cut dana hill lead to  with  left in rd
0,physic tomorrow is go to be a shit show
0,dual polici of lpg price not accept to public suggest is that govt should ration the price which may be upto rs
0,vandal in oakland same as the night befor in sf with afghan grown in â¦
0,rediff live hundr of afghan on thursday protest for the first time against cartoon of the prophet mohamm
0,didnt get a chanc to post thi the other day goodby ralph mcquarri may you return as a forc ghost to guid young artist starwar
0,thi is as brutal of a loss as it get up  then up  with  out in the th onli to blow it it go to be a veri long winter in wsh
0,on the news regard the marijuana march in toronto today if you dont hear em come youll smell them nicenot
0,sat watch the fuck celtic game sound like im miss a corker at white hart lane
0,not a veri attract line up have you got mackem v mag tomorrow
0,the intern committe of the red cross on friday warn that three palestinian hunger striker were at risk
0,mom just ask if i want to see the knick vs celtic in octoberi hate both team but it a live game hmm
0,danni care may be the best scrum half england have but he still a massiv cbomb
0,red cross syria conflict is now a civil war the intern committe of the red cross said on sunday it now
0,off to stolenspacelnd to see the shepard fairey show i didnt get to see last friday
0,the us game with shotton ha been call off due to a waterlog pitch so theyr now go to llani on wednesday night sorri lad
0,krul crock just put it out there craig gordon britain nd most eensiv keeper is without a club nufc safc ftm
0,appar justin beiber is in the area i know thi becaus i have student plural miss school tomorrow to see him
0,when mrcraig said sunday night wa offici the last day of march band
0,hamid mir ha reject the neg view of saleem safisana bucha  kamran shahid on pti peac march read hi tweet
0,distin derbi disappoint sylvain distin ha voic hi frustrat at take just a point from sunday mersey
0,the brickquad is the yanke of th period english iii with doc caputo targetonourback hatedbyal champion
0,i guess i shouldv been out give out book last night for world book day instead i sat in larg dark room watch the aveng assembl
0,karthikeyan in nd is alreadi be warn by hi hrt engin that he need to cool the brake with  lap still to go f
0,by botch case against lieberman israel ag may have made way for hi union with netanyahuhttp
0,just met the player for the st time thi roger johnson fella walk around like he own the place so i debag him  flick hi helmet
0,it is the th straight st round submiss not th straight st minut ko miesha tate did go  with her get it right
0,lpg price hike put on hold face stiff opposit the centr on thursday night put on hold the rs  incr
0,how they gone kill u on da st episod of the new season of breakout king damn no more eye candi miss you
0,thi mess is come toward us tomorrow spc ha a slight risk out for tomorrow and well know more about what it
0,cliff avril leav detroit lion game with back injuri detroit lion defens end cliff avril left sunday game
0,a singlevehicl crash earli sunday morn claim the life of a selma teen jame brandon bank  wa
0,steve emerson interview on shame us respons to islamist riot on sun tv  ipt in the news  the investigat via
0,just watch the whole nd season of breakout king onli to find out they cancel the fuck show
0,bjp member walk out from jpc meet on g bharatiya janata parti bjp member on tuesday walk out of the p
0,ahhh song joongki whi you still on the rd place  sob
0,who are the dumb ass who decid to shutdown main st on a friday for a town of  for a strawberri festiv
0,dont get me on the topic of andrew breitbart again i cri like a child last saturday
0,oh wait if georg osborn get ship out to space on the b ark from dougla adam book he go to demand an upgrad to st class
0,cliff avril leav detroit lion game with back injuri detroit lion defens end cliff avril left sunday game against the minn
0,jack welch and mort zuckerman are alway on give wisdom isnt their busi style part of what made thi mess in the st leansix
0,vbnss daili digit exchang lost  mln a day  oct   nyse nasdaq and the cboe each lost about  million in
0,slept for about  hour i seem to be in quit an odd mood ah well in play off tonight am and jack white on sunday
0,it seem right back is a problem at the minut shotton wa aw on tuesday
0,weak d and a penalti set up a short td run for eastern cat  with  left in st half
0,men latest bedroom worri  shade e l jame fifti shade of grey may be supercharg the seriv o
0,steve emerson on sun news network with michael coren  polit correct ha damag all aspect of lifehttp â¦
0,uk chancellor osborn tri to sneak into st class train with standard ticket  break news buzz
0,buse in the white hart lane  high road n area may be subject to divers  delay due to tottenham hotspur match
0,somebodi braid my hair tomorrow idc who but if it doesnt look good im take it out
0,bjp do drama to hide fact say minist  the govern tuesday accus the bharatiya janata parti bjp of
0,congress lash out at bjp over coal block issu lash out at the bharatiya janata parti on wednesday for it
0,i hate watch movi like friday after next on vh  bet mtv etc becaus they take out the bad languag  it no fun
0,im not get on twitter tomorrow becaus all my tl will consist of is a bunch of girl talk about justin beiber aintgottimeforthatshit
0,steve emerson on sun news network with michael coren  polit correct ha damag all aspect of life   via
0,here everybodi warn nobodi better piss me off tomorrow idc who you are im gonna snap done imatmybreakingpoint canttakethisanymor
0,best friend just arriv in nyc from australia damn it mean i cant watch the twohour open of terra nova tonight
0,hope i get to catch monday night footbal tonight havent got to see a game yetit onli preseason wk but feel like ive miss a lot
0,curti painter final go to get a shot tonight i cant help but root for that guy
0,peyton man  noooooooooooooooooooo if curti painter is start on sunday i am go to lose my shit
0,yah i know it on but it keep say monday night footbal and say mnf on the scoreboard im just confus bc it thursday
0,gotexan v the dirti jet footbal team on mnf tonight
0,so verland is start tomorrow against the indian and i have to stay over at work booooooo
0,weird music mood today  lot of hank william and johnni cash run through the iphon
0,worcestershir what are you on about still come down from your st half high worldwid fanbas is someth mcfc dont have mufc
0,mani want to go fu with the homi tonit for mnf the horn but i cant
0,spot price on kt gold is  dwt in tampa bay today  crazi that gold is over ounc  rememb when the real price wa
0,oooh haha well unfortun i realli shouldnt watch anoth tonight although i might but itd be blue which will make me
0,aw what the hell curti painter come in and we give up rd and  convers
0,today in the weird world of music historyhank william wa fire from the grand ole opri and told not to return until he wa sober
0,my son were watch mtv the other night look like an absolut freak show what happen to hank william johnni cash real music
0,i gave verland a slight edg over cc but after today against boston he is no cy young materi
0,dead on point u couldnt eect to sweep with verland pitchingnow if u get lucki tomorrow it gravi and huge
0,i fail to see whi the ram are play twice on mnf thi fallisnt onc enoughand their st div game isnt til wkunfrickinr
0,i hope my iphon get servic tonit to find out about dwt caus i have no power from the storm no tv no nuttin
0,lmao rt  curti painter look like the kind of guy who would tri to buy beer on sunday scumbag
0,hank william  whiski in an empti bar on a friday realli im that guy now fuck cute bartend but she chat with an off duti one
0,londonriot is trend rd worldwid  thi is not someth to be proud of unit kingdom sort it out
0,id recommend just turn it off and wait for verland tomorrow
4,i like who i am now other peopl may not im comfort i feel freer now i dont want grow older to matter to me  meryl streep
4,oh snap anoth sunday pool parti at shore club in miami with ryan moral jason vernau and olli sander well see you out there
4,i saw okay movi there friday nightris of the planet of the apesi still like conquest
4,to whom it may concern in luxembourg you like the madoff affair you will enjoy the apollonia affair affaireapollonia
4,i am happi to be singl but i would love to receiv a valentin card on the th it ha to be from someon amaz for eg
4,sheffield wednesday link with roger johnson ivan klasnic and michael antonio big coup if they get them massiv
4,ps launch game wed love to see these are our hope  dream soni be gentl with them opm a new postter
4,i have lot of spare jar marmalad is the one jam gi have not yet made so glad u found ash wed easi  uplift
4,girl gone wild gon be at my school thursday shit gon be crazzzzyy make sure i be my ass on campu lol npu
4,who els is excit to see the boy on startalk tomorrow
4,dont forget to dine out in savag tonight for paa also it america day tomorrow at the hs for homecom week
4,got you in th rd have a great year here we go steeler here we go
4,hear keynot speaker doug wead thi saturday june th at e the event dont miss it
4,star ship were made to flyyyy nowaynicki congrat you pass st grade
4,gamer dont even think about miss the blurb tonight on challeng at midnight weve got rage deu ex bodycount dead island  more
4,ash wednesday lyric she shout to the east god u better have someth better for me caus if thi is it well i want better than thi
4,happi monday stop by volar tonight for roast duck half roast crispi duck serv with babi spinach and
4,nova friend you wont want to miss thi monday fairfax victori ralli w mitt  the gop team mitthttp â¦
4,start friday night irv plaza nyc me and tour with chiodo  stoke
4,lmaohop your enjoy the sun love you so much proudsoldi camilla parker bowl lol xxx
4,big game with vcu tomorrow night secondplac is on the line letsgox
4,big day come up for word from cutom and up is we will have our bounci castl by tomorrow im pray their right ogoplay
4,caught up on true blood i love it now time for bed night peep be safe tonight
4,got a great piec for you histori buff friday morn a game between schalk  bayern that mark the end of germani greatest ever side
4,we cant possibl say enough good thing about both march fourth march band and moon hooch link up for
4,jungl island make good on  million payment jungl island made good wednesday on it promis to the miami citi
4,good win for nufc nine chang to sunday team and still do well got to keep thi go now nufc
4,panellist from world bank present on understand the potenti for youth and women and wat may help guarante success gcard c
4,cloudi in the valley good luck on your nd day of class see you in the emerald citi isat
4,and then on tuesday  wednesday it champion leagu match day  i think or it might be im not sure wooooo hooooo
4,mayoroflondon join in tomorrow at the excit london children book swap event for famili who love to read ld
4,fuck ye the girl scout just came to my door and i may or may not have bought ten box of thin mint
4,i would also just like to point out that the eagl had a win today
4,it raven stthen jetsthen eaglesget it right lol
4,hey sue so excit to see you at wppi u tomorrow were come don canada and would love to buy you a drink
4,good morn to you martina i hope your day is great too is it hot where you are it steam here in bama
4,just watch act of valor for the th time  i do like that movi
4,mav will beat the laker tomorrow accept all bet
4,world walk day in few more hour see you guy at putrajaya i am gonna bring my camera along â¦ fb
4,it the cool tasti ice cream sandwich upgrad  it may take some get use to sinc it newth
4,kendrick perkin led the leagu for the th year in a row in spm scowl per minut liter laugh out loud
4,anyon els find it entertain that ash wednesday and nation margarita day fall on the same day
4,it that time of year again the plain and the smell of saturday morn tailgatesit auburn footbal season wareagl
4,our se member the alresford commun choir to share the stage with brit award win on sep   how excit
4,mom left for scotland today or ireland keep forget where she went to but both place have cool accent i know that
4,becaus the night belong to lover  nuit blanch  video art love
4,the great noel gallagh is about to hit the stage in st paul plenti of room here so were th row center plenti of room pretti fire up
4,cant wait to see the anderson silva fight saturday woop woop
4,may even get to watch the north london derbi match at emir for the first time next season
4,sunday dine is alway amaz at volar restaur chicago with friend and famili we recommend start your
4,in an ideal world oregon and bois state will win sept rd and give power to the pac nw goduck
4,omg ricki martin may be gay but he is one fine ass gay man
4,today i came to the world of televis who know but may be veri soon i will be interview big time rush i wish thi all my soul
4,good friday afternoon construct  a crash on the ramp from  northbound to  northbound caus delay head up from brookwood
4,just hand in my applic for the mari colvin scholarship at the sunday time an excit moment
4,that movi flight with denzel look realli good may have to go check it out
4,out with the old in with the new shown good disciplin in the st  round tonight franki kept a cool head andthenew
4,d tweet a bit of sunday fun shot in whitstabl kent and muscat oman down pour the heaven httpt
4,glam girl want to invit everyon to enjoy halloween with them tomorrow at the grenad on riverview and rosedal from pm
4,look forward to go to carrow road with my brother tonight coy he mustv forgiven me for my behaviour at white hart lane in april
4,so pump for no school tomorrow and sleep in and even more excit for the hooch tennesse here i come
4,doe anyon rememb when we had to chose racer for the iditarod thing in th grade i had zoya denur along with  other peoplelol
