4,ga by my hous hit  im go to chapel hill on sat
0,iranian gener say israel iron dome cant deal with their missil keep talk like that and we may end up find out
4,with j davlar th main rival are team poland hope we an make it a success end to a tough week of train tomorrow
0,talk about act  sat decid where i want to go to colleg appli to colleg and everyth about colleg stress me out
4,one ticket left for the game tomorrow dont miss the rematch of the nfc championship game against the ny giant hit me up
4,never start work on your dream and goal tomorrowtomorrow never comesif it mean anyth to u act now getafterit
4,good morn thursday life is fragil were not guarante a tomorrow so give it everyth youv got  tim cook do it for job
4,twitit mcfli come back to argentina but thi time we want to come to mar del plata
4,anyth i wonder how the aspect btwn my sunmoon fair with my rise i also have venu in sagyea lol thank u
0,my teacher call themselv givng us candywasnt even the good stuff i might go to walmart or cv tomorrow
0,homegrown talent miss on sign day throughout most of the day on wednesday the video scoreboard  raleigh
4,taylor swift is come with ed sheeran june th most perf news ive heard all night
4,the great noel gallagh is about to hit the stage in st paul plenti of room here so were th row center plenti of room pretti fire up
4,amaz concert tonight with jim white and the tcu jazz ensemblefaculti jazz combo dont miss tomorrow night
4,capello say time for russia to win big match russia manag fabio capello on thursday said that he intend to
4,kickoff your weekend with servic ev get on the bu trip to the boy  girl club is friday from  hope to see you there
0,damn next saturday tho nigga wa trynna get shit over with earli
4,grammi concert pay move tribut to whitney houston whitney houston wa given a final sendoff by the grammi on thursday as hall
4,drew peterson is untouch no more check out these movi photo befor you watch on sun at c
4,pump to open the season tomorrow night against georgetown women preview  men preview
4,saeed nowplay bep ricki martin and kt tunstal great song to get you through your sunday hate the rain
4,omg ricki martin may be gay but he is one fine ass gay man
4,hell yea lmfaoo   see you tomorrow asia babi
4,nowplay michael jackson  she out of my life live at wembley juli  â¦ love it mjtune
0,nigga be on the laker dickw still gon finish damn near first seedwhil yo team be struggl for the th spot
4,im in the bathroom bump nigga in pari crunk ass hell like it my st time hear it thi song will never get old lol
4,th album out red millionswifti  grammi award  ama  bmi award reign entertain of the year acm yearstaylorswift
4,it midnight on the east coast which mean it birthday happi th birthday nick j
0,appl ceo apolog for errorridden new map app appl ceo tim cook apolog friday for the compani errorridden new mobil map
4,we are here for our th anniversari celebr you still have time to make it   s king dr
4,love how i skip everi categori of the nta besid the soap couldnt give half a fuck if everyth els went off the air tomorrow
0,esper will be without star player youssef msakni for the first leg of the champion leagu final against al ahli on saturday africa
0,the sun paolo di canio say beat aston villa tonight would be like have sex with madonna legend
0,obvious i am not a fan of dream high  and i havent even watch it well i watch the st epthat where i heard that song
4,black histori fact marsali is the st and onli artist to win both classic and jazz grammi award in one year and to repeat the next yr
4,watch david letterman with no audienc but play like they are still there is the nd most brilliant thing ive seen tonight
4,guy the marijuana law in colorado oregon and washington can pass thi tuesday highhop
4,breezin won the best pop instrument perform at the th grammi award
4,text from my dad you like charl dicken  obv look at my amazon wish list too late for sunday  whi th surpris
0,upset alert in acc men soccer  maryland down  to wake forest late in the ndand down a man after an earlier red card
0,realli bore of thi host on super sunday do noth but talk and rave about man utd biasprick
0,that crazi im more jealou of u go to joe pa grave i wa sad saturday when i walk past where the statu should be
4,mizzou commemor it win over kentucki with a tshirt no realli  dr saturday  yahoo sport â¦ fb
4,happi valentin day  everyday is the th
4,just watch the campaign with will ferrel and zack galafianaki good fun for a wednesday hilari
4,han mon dieu le remix de i am the best dan dream high  je meur
0,with all benson attent franki feel like a forgotten stepchild let found father him so he know we will never forget nd place
0,polic protest clash at republ day march in turkey on a day mark the th anniversari of the found
4,i will be particip in a googl hangout with tomorrow im super excit check it out â¦
4,aww love you austin river and happi to see you get start in st nba gamebut it against my boy let go spur spur nba
0,the glass may be rise but it not get ani warmer here lago del desierto argentina
4,fabio capello from what ive seen these day i can assur you russia are capabl of get a good result vs portug tomorrow cantwait
0,i may be the onli girl on the face of the earth that doesnt find chan tatum attract callmecrazi justsayin donthatem
0,give me  min with candi the dancer from deja vu im nut on my th pump she that bad lol
4,cof cof someon is go to germani on novemb  oh i realli envi you â¦
4,thank you snow for cancel class today now you may stop snow so that i can drive to chapel hill tomorrow id realli appreci it
4,chick in my class said flacco is the best qb in the leagu  whi is a chick talkin footbal  i cant wait for class tomorrow lol
4,entrepreneur angelinvestor pitch in on the new birthday parti  super bowl sunday treat
0,honesti is often best polici fabio capello russia coach i wa hope ronaldo injuri wa more seriou so he couldnt play tomorrow
0,thi is austin river st game and peopl suck him he a rooki chill
4,im enjoy celebr juic instead of sleep go to be fook tomorrow though
4,the woman in black  the legendari ghost thriller tour to dubai and abu dhabi in novemb  decemb more
4,franki i think im gonna have a date with my bed tomorrow me same that my boy
4,pray for moham morsi the new presid of egypt that he may continu to be a leader for freedom and peac
0,axl rose need to just give up now not later not soon not tomorrow now
4,happi halloween start thi wick wednesday off listen to pink floyd and leonard cohen get to take my boy out tonight yay
0,i wonder what cortes is think after watch that st half of total wank as for boruc you are a disgrac and a complet twat saintsfc
4,happi valentin day  onli if you live in brazil otherwis it just anoth irrit monday
4,saturday i buy my ticket for the tmhtour in belgium im so happi
4,thi goe way too fast it been alreadi a year that i saw avril lavign in concert  octob   one of the best day of my life
0,how mani contin wa the challeng film on  okay what did you fail nd grade
4,were go to be at boy and girl club to clean tomorrow at am they told us to bring boot and glove all are welcom
4,david letterman had an interest show on monday he is locat in new york citi becaus of the hurrican he
4,novemb my birthday month elect day a weekend in san fran with  napl for thanksgiv lot of friend  famili ye
0,ive been on tv a few time now still wait for the call from itv about danc on ice though start to think i may be too famou
4,i hope they make sure to take care of eli man giant vs pittsburgh on sunday nfl
4,wwe raw should be interest next week the road dogg return to wwe at the royal rumbl and shawn michael is go to be on raw monday
4,kendrick perkin led the leagu for the th year in a row in spm scowl per minut liter laugh out loud
4,eli man best th quarter qb in the game
0,i feel do bad my boo asia bday event mayb cancel for thi sunday i wa soooo look forward to it
4,shit yeah it thursday russel howard good news and celebr juic is on
4,pretti good thursday night with  if onli river would stop suck so bad  qualcomm stadium
4,im so good at gambl i just own la vega leav tomorrow morn for a weekend of dog sit and homework not a bad week
4,had a wonder workshop on thursday at sag offic with carol nadel of select cast she is such a
4,appl ceo apolog for errorridden new map app  appl ceo tim cook apolog friday for the compani erro
4,new die hard movi come out feb  look like bruce willi is go to be my valentin date
4,i like a video anonym  rememb rememb the th of novemb
4,me ill bring your birthday card in on friday kane aw realli it the thought that count id prefer a tv twat
4,gotta go see flight tomorrow denzel is the greatest actor ever
0,kobe in the th is like eli man bewar
0,scariest man aliv kendrick perkin is close nd  ray lewi is probabl the onli human be ever not born with an indoor voic
4,if the steeler play as good as they did sunday i say keep the bee uniform on all the way to the superbowl steeler
4,yo im excit for royal rumbl might book that monday off work so i can watch it
4,procrastin i need to get readi for the th district chicago polic ralli against violenc chitown cheer will be perform king dr
0,will you have lunch with me tomorrow nightrandom hoe that hit on castl nooooooooobeckett
4,happi th birthday nick j hope it one of the best youv accomplish so much alreadi and so much more to come love you
4,factsaboutm when i wa born on that day  it wa the nd day of chines new year immedi  i gotten lot of redpacket
0,work almost over with then these negro wont see my face till monday night
4,ill be do the senior bowl fun run with my niec next saturday
4,i hope i can get a ticket to the d concert in belgiumy cant order them till saturdaypfff
0,rd and goal at the  and river throw a int terribl pass by river  bad decis cost u game geez half time sd
4,egypt morsi get red carpet welcom in iran tehran aug  egypt moham morsi is in iran for the first visit
4,ground hog day is such a good film sunday is for food and film sunday
4,if seattl and portland were knit togeth and cover by the california sun youd have san fran kinda love it
4,i hope all your love one back in maryland are okay i didnt see you wednesday
4,ladi boner from chan tatum in the vow right now and the fact that i get mcdonald breakfast tomorrow with win
4,forget about dook now we own that seri anyway let beat state thi saturday as we continu on to a succes season
4,long drive too kentucki tomorrow hope gonna get the big buck we caught on cam at least we got play in the chevi
4,look forward to see the illeg eagl at dork tomorrow night with lin  amigo best eagl tribut band around illegaleagl
4,happi valentin day my love novemb is come
4,pakistan approv liberalis visa accord with india  islamabad nov  ian pakistan ha approv a liberalis v
0,fabio capello russia headcoach wish cristiano injuri wa more seriou russia will play against portug tomorrow in the wcq
0,i think i may be the onli person around not excit that beyonc is the half time perform for the superbowl
4,happi thursday enjoy the show so much last night watch x thankyoutimeshift have a great day my greek
0,the fact that i have no plan tomorrow night  it my last night in fl for a min
4,love the hair style from friday jason wu nyfw show were give you the stepbystep to recreat the look
4,dad what are you go to do in athen tomorrow me noth dad oh ok have fun i like my father
4,asia stock mostli up on us china data asian stock market advanc friday as a batch of upbeat econom data from the us and chi
4,celebr the chines new year in shanghai around februari and see a dragon danc dure the spring festiv amaz eerienc
4,cant wait for the new seri start on sunday over here in britain redjohn
4,publish a new blog entri novemb   otherwis known as sheila the great in art in the counti
4,dr moham morsi announc as egypt first elect presid after the gloriou th of jan revolut congratul
4,northern light sale on thursday great pedigre all the way through the catalogu genom the full packag view catalogu onlin
4,billi cundiff may be leav washington hope he wont miss the door on the way out
4,i think bowen and cofield will be better in nd yr and hope jenkin will be as good as he look last preseason but those are unhatch egg
0,news releas  octob  custom of the negro subgrid eerienc a partial outag today at pm cont
0,i do worri about the mental of the averag tweeter when i see jeremi kyle and christma trend on novemb st
0,a betray wife is legal allow to kill her adulter husband but may onli do so with her bare hand hong kong
4,russel howard then cuckoo then celebr juic then famili guy thursday night is the best night for comedi
4,hey member did you miss your shot at leonard cohen tix thi morn on  will have more for you on sunday
4,i wish i wa out md i wanna bear on negro shit is fun  go out sunday to ross snighter sunday finna pop off on twl
0,nick diaz said he would fight gsp tomorrow if the ufc ask except you know they wouldnt becaus your suspend
4,first tweet ever love san diego busi day like alway and readi for on fuel tv tomorrow
4,new icon i may just be chang icon a lot as long as jennett upload pic caus she is just too beauti
4,dr moham morsi announc as egypt first elect presid after the gloriou th of jan revolut
4,onli you can answer befor i tri there on wp a way to call rd p app like intent on android i wanna switch to wp
0,protest against the mitch daniel purdu presidenti nomin tomorrow loeb theater  pm bring a friend soapurdu
4,dr moham morsi announc as egypt st elect presid after the gloriou th of jan revolut congratul to egypt
4,nebraska place a nationlead nine player on the firstev senior bowl watch list releas saturday
0,watch my favourit behind the scene for the th time when jennif hudson goe awol excus me what the hell is go on
4,fabio capello from what ive seen these day i can assur you russia are capabl of get a good result vs portug tomorrow
4,photo fab find jason wu satin scarlet clutch at off th whoop whoop taken with instagram
4,success saturday have a great time at the th annual girlfriend group celebr wood cofield maddox
4,sag for life stacey april gabriel irieapril mrandmrscheek happi wed day gabe north star ballroom
4,thank to jesu cv my mom  my maryi wa abl to kick thi flu in  week now to make it wout my maryjan until monday struggl
4,just saw jennif hudson on th street she look great super skinni
0,nfl commission roger goodel say he may cancel the pro bowl would you care if there wa no pro bowl
4,recap i saw bad  on tuesday the spike lee documentari on michael jackson it wa beyond amaz  it wa onli show for  day
4,harri style rock lyle and scott he may onli be but be honest you wish you had hi life
4,februari th the day befor and best buddi to valentin day desper day
0,were eerienc some issu with fuel tv ch  should be back up friday or monday
4,kpop will psi be the first korean to win a grammi psi may qualifi for the upcom grammi award gangnam sti
4,stick and stone may break my bone but rugbi doe it better
0,is it evil to laugh when a rd grader read a short stori and at least five time mistak the name becki for blocki stickingtoit
0,visit to iran by five euro mp wa call off sat after tehran refus to let them meet with a jail activist
4,yay payday today and ill be in austin tomorrow nite to see leonard cohen i gotsa fourday weekend on my hand happi fukn halloween
4,long princeton and diggi imagin  happi valentin day yn februari  it been  m via
4,hey daryl great connect at anti frack colorado excit to have you in next issu deadlin is nov th
4,i am happi to be singl but i would love to receiv a valentin card on the th it ha to be from someon amaz for eg
0,nigga wa realli on some th grade shit tonight
0,toi israel admit  kill of arafat deputi israel for the first time on thursday admit respons
4,thank to everyon who came out friday night to see us with threat signal at dicken awesom night
4,cool thi is cool i manag to get the ct sun in the pic and black star for avril now for lawson
0,get on februari for valentin day the suav fucker
4,out with the old in with the new shown good disciplin in the st  round tonight franki kept a cool head andthenew
4,cant believ is onli  day older than me cant wait to see him again tomorrow with at fort canning singapor
4,were excit for trunk or treat tomorrow nov  night at the boy and girl club in pottstown it will start at
0,buffalo bill kyle william miss practic thursday for a second straight day buffalo bill bill nfl
0,i go on channel  to see what the weather is gonna be like tomorrow and taylor swift sing eewww getoffmytv
0,miss those day  when all the rel would just gather at th uncl hous and celebr chines new year  i guess itll not happen agn
4,hey guy tomorrow is now nation ground hog day i hope to see you all post about it hahahaha
0,on octob   i told taylor swift i wouldnt listen to her until she wrote about someth els one year later and here we are still
0,oh and rafa said befor the injuri he wa have the best year he ever had wa st in the race m
0,of othersjenel may have made mistak but she ha time to chang and be a better personit too late for youfuckhead
4,halloween is the third biggest parti day of the year behind new year eve and super bowl sunday
4,ill stop love jennett on the st feb februari ha onli  day so it doesnt count
4,awesom wed shoot in amsterdam today excit fot the next one on saturday in a castl in utrecht preview come soon
4,mitch daniel gave stephen colbert a purdu hat on thursday show i hope he burn it in a rage flame of glori
4,dr moham morsi announc as egypt st elect presid after the gloriou th of jan revolut congratul to egypt
4,go to finish watch the vow tomorrow  it such a cute movi c
4,bad girl club mexicoi so offici now mean most of the girl go off on each other i cant wait until monday d
4,just close your eye the sun is go down youll be alright no one can hurt you now come morn light you and ill be safe and sound np
4,proper buzz to watch the vow with tomorrow
0,rd mariah song of the night and nooooooooo that wa so bad xfactor
4,tomorrow our opportun to love continu the boy  girl club  jefferson meet us there at am w boot and glove if possibl
4,have to read charl dicken for homework may be the greatest thing ever
0,im not gon believ that victor cruz is the real deal until he line up outsid no slot and doesnt disappear like he did sunday
4,may your day be full of joy and happi happi birthday nick j
0,shouldnt have watch the grey last night becaus walk down a dark driveway when the sun decid to play hooki is not a good time
0,nigga boutta be droppin like fli down georgetown tomorrow  you wont catchh me there
0,so i heard my old crush is go to the bell game tomorrow and wanna talk wtf weird
4,watch the nd punish wish theyd make anoth one with quentin tarentino direct and thoma jane as castl
4,that movi flight with denzel look realli good may have to go check it out
4,and then on tuesday  wednesday it champion leagu match day  i think or it might be im not sure wooooo hooooo
4,just did spartacu  and saunaimma be sore tomorrow but so worth it
4,cannot wait to play san fran on sunday if we can beat them at home for the nfc championship we can beat them now
0,and then both team took dump in the nd round of the big danc ku flame out against ucla mizzou lose to northern iowa
0,cupid did so much work da st time that he dont wanna be my friend no more
0,i will not be abl to handl harri voic in kiss youand i may not surviv after hear all the song on take me home in their entireti
4,incred pass from vick to kyle william william out jump carr in the end zone  in nd
0,damn i dont wanna get on my comput tomorrow my harri feel are out of control and the outtak video broke me
4,congratul on you celebr british kid singer sophia grace and rosi st anniversari of a visit of your show how
4,wait for the highlight of my thursday night celebr juic nolif
4,northern light sale tomorrow follow the wexham cup bull sale sale of elit femal holstein  jersey a real treat of a sale no trick
0,happi valentin day is trend  but it not even februari
4,hi memi thank for agre to lead at sag would you be avail for a sun ani sun in dec rather than nov th i just learn
4,so readi to be done with class tomorrow and head to chapel hill to support my favorit wuwbb ladi
4,thi sunday come watch the raven take on the brown and help support the baltimor human societi captain
4,my mom work with the mother of the girl that won homecom queen at ph last friday and the compani just sent out the sweetest email
4,how badli i miss andi carrol know that the derbi game is tomorrow he alway play veri well and score against blue nose
4,you should attend champ thi frisatsun top  roller derbi team in the world we play indianapoli pm friday
4,premier leagu west ham v man citi on saturday our preview look at the stat  ha some interest bet tip â¦
4,i preorder it on thursdayfriday at midnight the night it came abl to preorder love you and franki
4,go boromay the forc be with you from the st second to the last
4,congratul kendal in germani it is  clock friday novemb  so happi bday
0,kendrick perkin may have the worst goate in all of sport
0,friday cnet updat is play one republ  appl ceo say sorri for io  map mess appl ceo tim cook ha said he wa extrem sorr
4,tomorrow is go to be a funfil day of email peopl on how and what to do so i can come back to murray in the spring stress
4,so proud of for the huge upset against maryland time for us to do the same tomorrow night godeac
4,i just rememb nigga in pari is a song delight what a saturday positivetrol
4,takbir dr moham morsi announc as egypt st elect presid after the gloriou th of jan revolut congratul to egypt
0,gop ha set the bar veri low with a th cycl promot a grossli unamerican idea potu as elect autocrat civic
0,cant wait to hear tomorrow cmag meet about horni coni  report baag wait  watch you will be grill tomorrow  cmag a hope
4,betstyleloung thi saturday will be turnt to the max come see me and rock out th and king dr
4,man utd v arsen on sat see the best defenc afc in the leagu conced  pgame against the best attack utd score  pgame
4,watch sunday harri and paul good it is too wellobserv and fearsom dri
4,wa think of harri redknapp for the job for the past few day now would be an absolut coup cmon shebbi
0,thi bitch just put frog back on lmfao throw back thursday
0,no you may not kick it tribe call quest answer a text from billi cundiff
4,happi valentin day to you that may have one
0,my bodi is exhaust i walk from th and jefferi to the lakefront where i accident sat on dead fish to th and king dr and back
0,and to the  girl in front of us that sat down and play templ run the whole time whi did you even come confus
4,love the hair style from friday jason wu new york fashion week show were give you the stepbystep to
0,too soon amazon open black friday deal store thanksgiv is week away the world seri onli end on sund
4,went to see the mysteri of charl dicken at the playhous theatr west end last thursday star simon callow it a must see
4,oh yay my mom just told me that my grammi is come tomorrow woot woot loveh
4,thi may be a littl forward  secretcountri but can you imagin the sex miranda lambert  blake
4,it so earli here in germani my american friend are just now get drunk off to pragu knucklehead talk to you on sunday czechrep
4,cant wait for you to come to dublin on monday so excit to see you
4,lol you mean pronounc it idk eitherhmmi like to say it like hairmay or hairmess lmfao idk okay
4,appl ceo apolog for errorridden new map app video appl ceo tim cook apolog friday for the compani
4,congrat to dj rd grade team go to the superbowl ill be there cheer
4,big game for tomorrow away vs the knick at msg person think knick will win first game msg crowd sandi disast
0,im assum that heb ran out of candi and peopl decid to give out pizza instead becaus it wa busier than super bowl sunday today
4,goodnight big day tomorrow im at the school to  argentina time becaus i stay to the mallin tomorrow ill tell you what is that
4,today is nation kiss day coz it no work day tomorrow
4,thi time tomorrow night ill be parti it up in chapel hill cantwait
0,in  hour i know if im gonna see the boy live on may st omgg im sooo scare for tomorrow
4,awesom respons guy the correct answer is sam gagner and brendan smith all of you will be put into the draw thi come thursday jt
0,lorenzo beasley he wa kill on juli th of last year on the corner of rd and king dr mile
4,would you be up for full day of movi at mine on thursday so far tarzan and the notebook is on the list
4,river to gate for onli the rd time thi season keep it up chief fantasi team need you
0,watch the vow for the th time and im still tear what wrong with thi movi it tooo omg i cant even
4,egypt presid moham morsi on monday pardon all those arrest between the start of the revolut t
4,kurt convey win the boy race in  with nick diaz come in nd around  round out the top  wa kenni castro
4,fyi  the ridicul ador ladybug larri bird give hi st piec of candi to is our produc director chri koch gorgeou daughter
0,realiz that ive just spent halloween super bowl sunday and my last two birthday either in the librari or in a comput lab
4,tonight never mind the buzzcock ha the hilari noel field again cant wait to download it tomorrow
4,now yall know all that halloween candi is gonna be on clearanc tomorrowy can save it for valentin day
0,as a point flacco had a  qbr last sunday even vet qb had a bad day
4,go to the georgetown game on friday imwearingblu istillloveeastview
4,sophia grace and rosi we know one of your song the sun come down na na na na â¦
4,come out and have some laugh with me spartacu and max at carolin comedi club thi wednesday octob th
0,fuck you band that cover it on friday night and fuck you ricki martin for exist in the first place you big jerk
